"","jobtitle","joblink","jobLevel","budget","date","content","tags","numberOFfreelancers","totalspent","customerscore","country","customertype","score","Nfeedback"
"34","Hiring Writers - Long term. Full time. (Finance/Statistics/SPSS/Healthcare/Nursing/Law)","https://www.upwork.com/job/Hiring-Writers-Long-term-Full-time-Finance-Statistics-SPSS-Healthcare-Nursing-Law_~01f9e016e12e33adff/","Entrylevel",500,2019-06-14,"We are looking for full time writers. This job is long term. The following are the requirements. 1. Efficient enough to write 40 000 words per month 2. Versatile enough to handle a large variety of writing projects 3. Can meet deadlines 4. Have experience with various referencing style 5. Able to produce original work with no copy/paste and no use of word-spinning softwares 6. Able to address all client requirements and follow all client instructions Starting pay for 40 000 words is $500. Pay will increase based on performance. less",NA,2,"$20k+ ","4.72 Stars, based on 132 feedbacks","Australia",NA,4.72,132
"35","Statistics Expert needed","https://www.upwork.com/job/Statistics-Expert-needed_~013f1fb1d8124ad790/","Expert",NA,2019-06-14,"I need someone with deep statistical skills to help me make sense of quite a lot of data that I have. I use Pandas & Excel. Either skill works for me. I want to get deep into distributions, modeling, testing and simulation. Let me know if you can help! less",NA,NA,"$100k+ ","4.85 Stars, based on 41 feedbacks","United States",NA,4.85,41
"36","ECommerce Analytics Set up Audit & Fix Recommendation","https://www.upwork.com/job/ECommerce-Analytics-Set-Audit-amp-Fix-Recommendation_~011abb4880953f8afd/","Intermediate",100,2019-06-14,"I need a complete audit of the Google Analytics set up (tool & site tagging) in order to: - Ensure ecommerce is properly set up. - provide recommendations and guidance on creation and use of campaign tracking codes. - Audit, set up and test/confirm that conversion tracking is working. Help set up ""goals"". - Audit, set up and confirm conversion channel attribution is working. Help track funnels. - Create 2 dashboards providing weekly and monthly insights into channel conversion and attribution. SITE: To be provided after the first interview and before final selection. Business: Wholesale ecommerce selling lots and pallets of consumer products. less","Google Analytics, Google AdWords",NA,"$4k+ ","4.94 Stars, based on 22 feedbacks","United States",NA,4.94,22
"37","research","https://www.upwork.com/job/research_~017cd11dd27f92892a/","Intermediate",100,2019-06-14,"For company strategy and presentations, we need some parking statistics in New York.",NA,NA,"$6k+ ","4.97 Stars, based on 59 feedbacks","United States",NA,4.97,59
"38","Convert Quantopian model to QuantConnect (Algorithmic Trading)","https://www.upwork.com/job/Convert-Quantopian-model-QuantConnect-Algorithmic-Trading_~0104c07acb2010a060/","Intermediate",200,2019-06-14,"I'm looking for assistance with converting a Python algorithm from Quantopian to QuantConnect. The current length of the algorithm is just less than 300 lines. Obviously must be familiar with both platforms. If certain data sources/pipelines are exclusive to Quantopian, equivalents must be used for QuantConnect such that backtest and papertests are equivalent to a reasonable degree. See sources/pipelines currently used below: from quantopian.pipeline import Pipeline from quantopian.algorithm import attach_pipeline, pipeline_output from quantopian.pipeline.data.builtin import USEquityPricing from quantopian.pipeline.data import morningstar from quantopian.pipeline.factors import SimpleMovingAverage, AverageDollarVolume from quantopian.pipeline.filters.morningstar import IsPrimaryShare less","Algorithms, Python, Quantitative Finance",NA,"$100+ ","5.00 Stars, based on 1 feedback","Canada",NA,5,1
"39","Extract area covered by a mask and a median color below the mask","https://www.upwork.com/job/Extract-area-covered-mask-and-median-color-below-the-mask_~01c021c95e75a9e010/","Entrylevel",NA,2019-06-13,"Write a script that takes a satellite image like this one https://deepdom.s3.amazonaws.com/media/satellite/BQlBfkIhOzQSGpwD_XcDrwPo.jpg and a mask like this one https://deepdom.s3.amazonaws.com/media/annotation/BQlBfkIhOzQSGpwD-buildings-mask.png and extracts: * area of the building in the center of the mask * median pixel color in the mask (we want to interpret this as the color of the roof) Threshold the mask at the 0.5 level. less","Python, Computer Vision, Image/Object Recognition, Numpy, OpenCV, ",NA,"$6k+ ","4.87 Stars, based on 19 feedbacks","Poland",NA,4.87,19
"40","Guidance for Writing Personal Statement for a Neuroscience/ Developmental Psychology Master's in UK","https://www.upwork.com/job/Guidance-for-Writing-Personal-Statement-for-Neuroscience-Developmental-Psychology-Master_~0177dd59b94a1bb8fb/","Expert",NA,2019-06-13,"Hi there! I'm looking for someone with a background in neuroscience, developmental psychology, and/or experimental psychology. It is also highly preferred that the individual has completed/ is in the process of completing a Master's in the UK. I hope to apply for 5-6 highly competitive Master's programs in neuroscience, developmental psychology, and/or experimental psychology by November. My background is a bit unconventional but meets the entry requirements for all of these programs. I may also need advice on other aspects of the applications. Thank you so much in advance! Looking forward to hearing from you. less","Academic Higher-ed, Experiment Design, Human Sciences, Psycholinguistics, ",4,"$100 ","5.00 Stars, based on 1 feedback","United States",NA,5,1
"41","Excel + VBA Template Designer","https://www.upwork.com/job/Excel-VBA-Template-Designer_~01236b6f6878a0be29/","Expert",NA,2019-06-13,"Develop Excel model template to automate data analysis, charting, develop outputs to be embedded in client presentations, ensure consistent brand guidelines are applied to all reports, and develop Macros in VBA to automate processes. Beautiful report design is a top priority for this project. Must have experience with: - Expert Excel formula knowledge - Expert Excel VBA Programming - Expert in Data Visualization - Expert in User Experience Design - Finance experience a plus The best candidates will give us detailed examples of work they have done and be able to give detailed interviews that explain the logic and processes they used. less","Business Planning, Financial Analysis, Statistics,   ",NA,"$0 ","No feedback yet","United States",NA,NA,NA
"42","Agronomist for on-demand Geo-spatial Data Analytics","https://www.upwork.com/job/Agronomist-for-demand-Geo-spatial-Data-Analytics_~01e551abbd671d42d8/","Intermediate",NA,2019-06-13,"We are a consulting firm for farmers in Indonesia. We are currently looking for knowledgable agronomist who can understand geospatial data and deduce a strategy to optimize the methods of production. Requirements: - Minimum of two years experience in the Agriculture Industry - Vast understanding of new and upcoming technologies and breakthroughs in the industry - Fluent English - Understand Geospatial data to be able to prescribe treatments to plants - Understand Smart farming - Familiar with IOT and precision farming - Work online - Understand vegetative indexes such as NDVI, OSAVI, chlorophyl levels, etc - Fluent in utilizing softwares in the agriculture industry - Be able to raise the profitability index of arable land - Understand Climate and crops in Indonesia less",NA,NA,"$0 ","No feedback yet","United States",NA,NA,NA
"43","Helping in Sentiment Analysis Research","https://www.upwork.com/job/Helping-Sentiment-Analysis-Research_~01ab362b8b1c3f6fb5/","Intermediate",50,2019-06-13,"Looking for a data science researcher helping in guiding and programming. Contact FMD This job was posted from a mobile device, so please pardon any typos or any missing details.","Data Analytics, Data Science, Python, R",NA,"$10 ","No feedback yet","United Kingdom",NA,NA,NA
"44","SQL work to pull data from multiple Access databases and prepare analysis","https://www.upwork.com/job/SQL-work-pull-data-from-multiple-Access-databases-and-prepare-analysis_~01da481a9b0f8386bd/","Entrylevel",NA,2019-06-13,"I have pulled data from multiple systems into an Access database. I need assistance creating analysis using PowerBI or Quicksights. The data is from our CRM and ERP and the initial analysis will be reconciling the CRM data to the ERP data to confirm that all clients have been appropriately billed as per the statement of work. I have already created all the analysis in Excel. I need someone to translate it into PowerBI. less","Business Intelligence, Data Mining, Data Visualization, Databases,  ",NA,"$10k+ ","4.80 Stars, based on 1 feedback","United States",NA,4.8,1
"45","InfoGraphic Document Design","https://www.upwork.com/job/InfoGraphic-Document-Design_~0136a5a931a093eb12/","Intermediate",NA,2019-06-13,"Create a 3 page document creatively displaying highlights of a report full of excel charts and tables. Final product to be letter sized pdf AND individual charted graphics used in the info graphic to be able to drop into a powerpoint (e.g. png files) ... more","Infographics, Adobe InDesign",NA,"$200+ ","No feedback yet","United States",NA,NA,NA
"46","Data Analytics","https://www.upwork.com/job/Data-Analytics_~015defe0f03236bc7c/","Intermediate",NA,2019-06-13,"Excellent Research and Data mining capabilities! Television downloads statistics and TV Network and TV show revenues. Licensing statistics and Revenues. Travel and Tourism Industry stats and expenditures.",NA,NA,"$0 ","No feedback yet","United States",NA,NA,NA
"47","Medical literature and database search; statistics","https://www.upwork.com/job/Medical-literature-and-database-search-statistics_~01f734d2305f32f729/","Expert",NA,2019-06-13,"Medical literature and database search and analysis","Biochemistry, Bioinformatics, Biotechnology,   ",2,"$6k+ ","No feedback yet","Canada",NA,NA,NA
"48","Build a custom Singer Tap for Tempo data","https://www.upwork.com/job/Build-custom-Singer-Tap-for-Tempo-data_~0185ff49935f76ac8e/","Intermediate",400,2019-06-13,"We use StitchData to load data from various sources into Google BigQuery for use in Google Data Studio. StitchData provides many of the connectors we need, however there are some missing. The most important is Tempo time tracking and planning data. In order for StitchData to extract this data we need a custom Singer Tap which StitchData can run . We would need to pull data from the following Tempo endpoints (https://tempo-io.github.io/tempo-api-docs): Accounts Plans Worklogs We can use token login for the Tempo API, no need for OAUTH unless it's easy to setup, just need to make sure the token can be stored somewhere securely. We would also need a Stitch target for this work: https://github.com/singer-io/target-stitch - this would have to replicate to an import API integration (https://www.stitchdata.com/docs/integrations/import-api). And for it to all be setup to run on a suitable server (eg heroku) less","Python, ETL Pipelines",NA,"$90k+ ","5.00 Stars, based on 16 feedbacks","United States",NA,5,16
"49","Quick English to Portuguese SEO keyword translation","https://www.upwork.com/job/Quick-English-Portuguese-SEO-keyword-translation_~01f1ad18512462244f/","Intermediate",10,2019-06-13,"I have a very quick job for someone skilled in SEO keyword research, you can expect quick payment and a glowing review if you can help me out, tomorrow at the latest (14 June). I have five travel-compensation related keywords in English that i need ... more","English, SEO Auditing",NA,"$0 ","No feedback yet","Lithuania",NA,NA,NA
"50","Need Levey Jennings chart template created in Excel","https://www.upwork.com/job/Need-Levey-Jennings-chart-template-created-Excel_~01cefe4096092eae0a/","Expert",50,2019-06-13,"I need someone to create an Excel template described here: http://www.bioline.org.br/request?mb11114 And have it look like the chart in the attached, but I can modify the labels as much as I need to. Another good example is here, but I can't get it ... more","Microsoft Excel",NA,"$800+ ","5.00 Stars, based on 13 feedbacks","United States",NA,5,13
"51","Analysis of Data on SPSS","https://www.upwork.com/job/Analysis-Data-SPSS_~018f5e9ed58c4f8999/","Expert",100,2019-06-13,"Hi, I need help analysing data on SPSS. I conducted an experiment in which participants had to fill in a PANAS questionnaire. I need to do a component analysis and a reliability analysis. I also need to do either a T-Test or an ANOVA to see if there is a relationship between the variables. I need someone who has experience in SPSS. less","IBM SPSS",NA,"$0 ","No feedback yet","France",NA,NA,NA
"52","Remote Sales Rep | Dedicated Inside Sales | B2B Advertising Sales","https://www.upwork.com/job/Remote-Sales-Rep-Dedicated-Inside-Sales-B2B-Advertising-Sales_~01bc19b70dd1f46fbf/","Expert",NA,2019-06-13,"Hello, We're looking for creative and dynamic ad sale professionals to join our team. CHARGED is the leading B2B magazine, website and news feed for the electric and hybrid vehicle industry. CHARGED readers are key decision makers throughout the EV industry: from small start-ups to the biggest automakers. Headquartered in Saint Petersburg, Florida, we're seeking additions to our print and digital ad sales team. The vast majority of the business is done via phone and email. Some travel is optional to attend trade shows around North America and Europe. Candidates must be willing to learn quickly, with an entrepreneurial spirit and high energy to drive results. A self-starter and ability to work independently is a requirement. The electric vehicle industry is one of the most exciting and fastest growing sectors in the world. Apply to learn more about our position in the industry and plans for growth. Qualifications: Previous experience in sales, customer service, or related field is preferred Marketing or advertising experience is helpful but not required Strong self-starter qualities with an entrepreneurial spirit Ability to build rapport with clients Responsibilities: Oversee and coordinate sales activities Manage sales territories, quotas, and goals for the sales team Analyze sales statistics to identify areas of improvement Track results and trends regularly for business forecasting Report on team and individual performance Develop and execute innovative sales strategies Build and form new partnerships with potential clients less","Cold Calling, Email Handling, Web Research, Appointments,  ",2,"$10k+ ","4.80 Stars, based on 44 feedbacks","United States",NA,4.8,44
"53","Looking for Data Analyst to manage simple data from IoT sensors","https://www.upwork.com/job/Looking-for-Data-Analyst-manage-simple-data-from-IoT-sensors_~014f7ca0f1c5f7a1cb/","Entrylevel",NA,2019-06-13,"We are looking for someone to be in charge of monitoring sensors from the web dashboard to ensure they are displaying data to our customers and deliver weekly reports on what sensors are down. We are looking for someone to commit 5-7 hours per week on this. less","Microsoft Excel",NA,"$7k+ ","4.98 Stars, based on 25 feedbacks","Canada",NA,4.98,25
"54","Quick Analytics and Search Console Screenshare Consultation to Identify Issues for Traffic Decrease","https://www.upwork.com/job/Quick-Analytics-and-Search-Console-Screenshare-Consultation-Identify-Issues-for-Traffic-Decrease_~016c0e2ab8522a7540/","Expert",NA,2019-06-13,"I would like to meet with an expert who can review my Google analytics and Search Console accounts via screen share in real time. I have had a traffic dropoff in the past month after a change in WordPress themes. Most of the traffic lost appears to be Organic Search. I want to figure out the reasons for decrease in Organic Search. I need someone to quickly look at the page HTML and figure out the issues. I likely will be able to fix the issues on my own after the expert freelancer helps me identify them. less","Google Analytics, Google Search Console, SEO Auditing",NA,"$4k+ ","5.00 Stars, based on 18 feedbacks","United States",NA,5,18
"55","Regression Sales Forecasting","https://www.upwork.com/job/Regression-Sales-Forecasting_~017b62ddbb7ab0945b/","Intermediate",NA,2019-06-13,"We would like to create a model to forecast sales and units sold and choose independent variables to be able to do this accurately. We will provide a sample data set that will allow model creation.","Microsoft Excel, R",NA,"$3k+ ","5.00 Stars, based on 23 feedbacks","United States",NA,5,23
"56","Zoho Analytics Reporting Dashboards","https://www.upwork.com/job/Zoho-Analytics-Reporting-Dashboards_~011b765855fe08ef74/","Entrylevel",NA,2019-06-13,"I need someone who has EXTENSIVE experience with Zoho analytics that can setup our analytics platform to be able to show real time reporting. Must have 3+ years experience with Zoho analytics.",NA,NA,"$1k+ ","5.00 Stars, based on 12 feedbacks","United States",NA,5,12
"57","Polygon mapping tool","https://www.upwork.com/job/Polygon-mapping-tool_~0179ef6deca8a4761f/","Intermediate",NA,2019-06-13,"I need a mapping tool that works with Google that would allow me to draw custom polygons and save that data to a database.",NA,NA,"$20 ","No feedback yet","United States",NA,NA,NA
"58","R Expert needed to forecast forest growth data","https://www.upwork.com/job/Expert-needed-forecast-forest-growth-data_~01cf705249538ceea2/","Expert",110,2019-06-13,"Searching for R Expert to forecast forest growth data using non-linear mixed effects models. Interested in someone willing to be creative to solve the challenge. I am willing to add an extra 40 USD to anyone who successfully fits a model that reasona ... more","R",NA,"$300+ ","4.99 Stars, based on 10 feedbacks","United Kingdom",NA,4.99,10
"59","Google Analytics Expert - short contract","https://www.upwork.com/job/Google-Analytics-Expert-short-contract_~01bf9856f60b86474e/","Expert",200,2019-06-13,"FanShare Sports needs to build a user-friendly dashboard in order that site admins can easily track: Weekly site visitors (new and returning / registered users) Conversion rate of new visitors to registered user Conversion of registered users to paying subscribers (breakdown of weekly, monthly, and annual subscription) Average transaction value less","Google Analytics",NA,"$70k+ ","5.00 Stars, based on 1 feedback","Canada",NA,5,1
"60","research master VA shopify management and development","https://www.upwork.com/job/research-master-shopify-management-and-development_~01a6078c9e6b1c18ca/","Expert",700,2019-06-13,"Please watch this video before replying to this ad and give me an idea of what you learned from it when applying and if you think you can help. I'm looking for a full time worker or one large job so a VA can maintain it. https://www.loom.com/share/96790a556ac141dda90a8c9856990093 I need someone to fully manage my inventory, suppliers inclusive to all their shipping policies and coordinate with the inventory list I have now. I also need you to be able to work on design and make changes accordingly to shipping, prices, tags. I need someone willing to engage in market research to help me best price the products and which products to add. They must know google analytics, Adwords, SEM, Shopify development/design/ accounting and have experience running a large ecom store. I have all the systems in place I just need you to help me touch everything up and get it running smoothly so my marketer can run everything the way he needs to less",NA,NA,"$700+ ","4.20 Stars, based on 9 feedbacks","United States",NA,4.2,9
"61","Find the person's email who can add my link to their page.","https://www.upwork.com/job/Find-the-person-email-who-can-add-link-their-page_~0183aa9b8e00f10de1/","Intermediate",500,2019-06-13,"I need you to navigate to a URL (using a web-based system that I provide) and find the email that I will need to contact in order to get a link added to their page. The exact instructions (which I will provide upon hire) are also listyed at the bottom of this post. I will provide the website I am asking them to link to in the web-based interface. If the page is not valid (ie, it is not appropriate to ask for a link on the page to my website) - mark it as 'Not Valid.' I will pay you $1 for every email you find (I will be checking accuracy of the emails you submit). I just need you to try and find the right email. I will also pay $0.10 for every page you mark as 'Not Valid' since this task typically takes a small fraction of the time to determine if the page isn't valid. See attached screenshot of the web-based interface that I will provide to you. You will have a login and can do this work anytime you'd like. I keep track of statistics like how many emails you've completed per week so you know how much to bill me for. For example, if the URL I give you is this: https://www2.ewu.edu/cstem/departments/mathematics/math-degrees/careers-in-mathematics Then you would provide me the email 'mgrant@ewu.edu' (you can see it listed at the bottom-left of the page) because that is the faculty member who maintains it. You should NOT provide me a boilerplate webmaster email for wustl.edu. I want the specific email for the specific person that maintains that specific page or group of pages. I can afford to pay up to $500 per week ($2,000 per month) to start with, and can either increase or decrease volume based on the results of what you give me. EXACT INSTRUCTIONS: 2. Navigate (left click) to each url that you are presented with 3. If no email exists, the URL does not work, or the page is not in English, then click 'Not Valid' - otherwise, proceed to step 4. 4. Determine whether or not this page is appropriate to ask for a link to be placed on it to my site (you have this information in your main 'list' page). If it's not relevant to ask for a link on, then go back to the Sitedial window, and click 'Not Valid.' If the URL is relevant to ask for a link to be placed going back to my site, then proceed to step 5. 5. Visit the URL and click around the website if needed to find the email address of the person that would update and add a link to the specific webpage, or - if unavailable - the website's general webmaster. If neither of those is present, try and find a general contact email for the site, and if that is also not present, 6. You can also use site queries in Google to try and find the webmaster, such as ""site:example.com webmaster"" or “example.com contact” 7. When you find the email, record the email address into the textbox underneath the URL back on the Sitedial page (please note, we use email validation to determine is an email exists & is active, so if the email does not exist - you will be flagged to try another email) 5. If no email exists, and you cannot find it, simply leave the box blank click 'Not Found' Thank you! less","Link Building, SEO Backlinks, Data Entry,  ",NA,"$20k+ ","4.96 Stars, based on 39 feedbacks","United States",NA,4.96,39
"62","Write an article for getting an internship in Data Science","https://www.upwork.com/job/Write-article-for-getting-internship-Data-Science_~013dc49819871a8132/","Intermediate",300,2019-06-13,"I'm looking for an exceptional writer in the data science field that can put together an article about data science internships. This would be ideal for someone that has experience as a data science intern or as someone that hires data science inter ... more",NA,NA,"$0 ","No feedback yet","United States",NA,NA,NA
"63","Quantitative Finance or Financial Engineering professional needed to Build an Anomaly detection Algo","https://www.upwork.com/job/Quantitative-Finance-Financial-Engineering-professional-needed-Build-Anomaly-detection-Algo_~01983fbda02a8afba2/","Expert",300,2019-06-13,"I need to build a time series analysis model for a universe of assets. It needs to be able to run variance analysis and filter the stocks with constant variance...and then spit out a principal component analysis x and y plot catagorising the assets w ... more","Financial Analysis, Mathematics, MATLAB, Statistics,  ",NA,"$0 ","No feedback yet","Singapore",NA,NA,NA
"64","Amazon Online Arbitrage OAxray Lists","https://www.upwork.com/job/Amazon-Online-Arbitrage-OAxray-Lists_~01cba42a86136035da/","Intermediate",25,2019-06-13,"I need a list of around 40 to 50 items for Amazon Online Arbitrage..... All the ROI has to be above 45%. Big stores like Kohl's, Walmart,Target,bestbuy This must be completed today with the sales rank store url Amazon url roi pricing in Excel sheet format less",NA,NA,"$6k+ ","5.00 Stars, based on 1 feedback","United States",NA,5,1
"65","Trainer--Power BI & Tableau","https://www.upwork.com/job/Trainer-Power-amp-Tableau_~01285e8ef1ff52e589/","Intermediate",NA,2019-06-13,"We are looking for someone who can trainer our people Online on Power BI and Tableau. Practice on live based scenarios and on job support would be an added advantage.",NA,NA,"$0 ","No feedback yet","India",NA,NA,NA
