"","jobtitle","joblink","jobLevel","budget","date","content","tags","numberOFfreelancers","totalspent","customerscore","country","customertype","score","Nfeedback"
"66","Testing developer needed for creating a responsive WordPress Theme","https://www.upwork.com/job/Testing-developer-needed-for-creating-responsive-WordPress-Theme_~015c443cadfe94e810/","Intermediate",NA,2019-06-13,"Data analyst responsibilities include conducting full lifecycle analysis to include requirements, activities and design. Data analysts will develop analysis and reporting capabilities. They will also monitor performance and quality control plans to identify improvements. Responsibilities Interpret data, analyze results using statistical techniques and provide ongoing reports Develop and implement databases, data collection systems, data analytics and other strategies that optimize statistical efficiency and quality Acquire data from primary or secondary data sources and maintain databases/data systems Identify, analyze, and interpret trends or patterns in complex data sets Filter and “clean” data by reviewing computer reports, printouts, and performance indicators to locate and correct code problems Work with management to prioritize business and information needs Locate and define new process improvement opportunities less",NA,NA,"$0 ","No feedback yet","Brazil",NA,NA,NA
"67","Amazon Seller Software Program Created","https://www.upwork.com/job/Amazon-Seller-Software-Program-Created_~018d4cc17d1c6b7067/","Entrylevel",400,2019-06-13,"Here is what I need. This can be between chrome extension and web tool. 1) Keyword research tool - It pulls auto suggested keywords from search bar into one spreadsheet. So basically type in a keyword and then a letters A-Z and then pulls the keywords that show for each letter after main keyword. Then once it has that list, it does the same things will all keywords with A-Z to find the rest (Amazon, Google, Bing, YouTube, Ebay, Play Store) 2) ASIN and BSR tool - Shows ASIN and BSR on Amazon when searching for something. It shows this on search results, product page, and category / best seller page 3) Tool that alerts for any changes in: Title, Bullet Points, Price, Description, Pictures, Product Variations, Product Weight Changes (Email, SMS or Telegram) This is for own product and competitors 4) A tool that pulls all important statistics from Seller Central and Amazon Account into one easy place and sends daily/weekly totals to (Email, SMS, Telegram) 5) Price and BSR tracker with graph for own product and competitors 6) Keyword tracking - add keywords and see rankings for each keyword for product. Keeps graph of positions. You can add different produts and see 7) BSR changes alerts - send (Email, SMS, Telegram) when change in BSR 8) Duplicate word remover - Put any text into tool and it removes any word that is duplicate - Then it scans listing and tell you what words have not been used 9) Product Review and Seller feedback alerts - Send (Email, SMS or Telegram) whenever new review or feedback shows less",NA,NA,"$5k+ ","4.99 Stars, based on 136 feedbacks","United States",NA,4.99,136
"68","Magento 2 Multivendor Marketplaces 3rd party consultant.","https://www.upwork.com/job/Magento-Multivendor-Marketplaces-3rd-party-consultant_~01092ad7fcd6fbb6d2/","Intermediate",NA,2019-06-13,"REQUEST FOR PROPOSAL MANAGEMENT CONSULTANT MUTIPLE MAGENTO 2 MULTIVENDOR MARKETPLACES 1. General Services Scope • Provide consultation as requested for up to 20 Magento 2 Multivendor Marketplaces both live and under construction. • Provide consultation as requested for new extension developments for the sites. • Provide consultation on the coding, settings and general practices used by our developer of the marketplaces both live and under construction. • Provide consultation on the coding, settings and general practices used by our developer for extensions that are both live and under construction. 2. General Proponent Requirements • Magento 2 certified • Extensive Magento 2 Multivendor Marketplace experience • Proficient at coding and debugging of Magento 2 Multivendor Marketplaces and extensions for such. • Excellent English language and speaking skills • Knowledge of SEO practices and requirements • Knowledge of general Magento 2 Multivendor Marketplace integration to Social Media and other marketing tools. • Knowledge of all extensions on the market for Magento 2 specifically for the Canadian and US markets and the integration of such as required. • Knowledge of making all our sites US and Canadian dual market capable 3. Proposal Inclusions • Hourly rates • Certificates of qualifications • Minimum of 3 Business References relating directly to our scope. • Hours of availability Mountain Standard Time in Canada less",NA,NA,"$0 ","No feedback yet","Canada",NA,NA,NA
"69","Full stack developer needed for HR System","https://www.upwork.com/job/Full-stack-developer-needed-for-System_~0182f1e2776bcc46ae/","Expert",NA,2019-06-13,"Develop front and back-end of a new could-based multi-account HR system. A user must be able to access and manage their own private company account within the software. We look to https://factorialhr.com/ as an example of our end product. Starting with an open-source solution like OrangeHRM and customizing the core is also an option for someone with knowledge of that system. Modules include: Onboarding Module: - Create employee profiles - Creating and editing onboarding tasks - Assigning onboarding tasks to employees - Tracking onboardings tasks - Task management dashboard Performance Tracking Module Goal tracking Performance feedback Generating reports about employees’ performance (detailed transcripts of achievements), overall company performance and more Benefits Management Module - Adding benefit plans - Sharing benefit plans with employees - Generating reports about amount of benefits per employee, monthly benefit expenditures, etc. - Statistics dashboard Training Module: - Lists of trainings - Scheduling trainings - Tracking employee training progress - Events calendar - Application system for trainings - Document management Payroll Module: - Payroll tracking - Request management (sick leave, time off, vacation) - Work hours tracking - Compensation and benefit plans - Payroll notifications - Generation of payment reports and paychecks - Payroll dashboard for employees We are looking for an experienced freelancer (or perhaps group of freelancers) to build and maintain this software. You must be able to: - Meet deadlines and have excellent communication skills - Create wireframes to help decide on layout - Run functionality testings and debug code - Expert understanding of best security practices - Give formal and informal internal presentations keeping teams up to date on latest development options less",NA,NA,"$600+ ","No feedback yet","Canada",NA,NA,NA
"70","Excel/VBA- Linear Programming-Creating Shifts","https://www.upwork.com/job/Excel-VBA-Linear-Programming-Creating-Shifts_~0190134ac2d312a136/","Expert",100,2019-06-13,"Need an Excel Based automated system that creates shift combinations based on the following constraints (not limited to) 1. Part time & Full time employees 2. Staff availability 3. Half hourly interval requirement - 12 hours operation (8am-8pm) 4. Ranking/priority - subjective and performance based 5. Day offs 6. Morning shift - mid - late, bi-monthly rotations Goal is to make sure that we have the required number of heads per interval while optimising the number of part time hours This job was posted from a mobile device, so please pardon any typos or any missing details. less","Data Analytics, Excel VBA, Linear Programming,  ",NA,"$200+ ","5.00 Stars, based on 8 feedbacks","Australia",NA,5,8
"71","Agricultural Economics: Thesis about Food imports and food security in Mozambique","https://www.upwork.com/job/Agricultural-Economics-Thesis-about-Food-imports-and-food-security-Mozambique_~01a7e82e38c26adf21/","Entrylevel",NA,2019-06-13,"I need someone who really knows about Agricultural Economics. In fact, we can work together I would need help for some data entry and some statistical analysis. Since I'm just starting this thesis project, I would like to have some help to clearly state the research questions and methodology (which indicators to use). The initial question of the research was ""The trend in food imports still increasing in Sub-Saharan Africa? Please look at this site: https://ilsi.org/wp-content/uploads/2017/01/1_Tschirley_Urbanization-food-systems-and-the-diet.pdf see slide number 20, the research would like to reply a similar analysis in many countries or just focus on Mozambique and go with furthers topics. less","Academic Writing",NA,"$0 ","No feedback yet","Germany",NA,NA,NA
"72","Create a pivot table in google sheets","https://www.upwork.com/job/Create-pivot-table-google-sheets_~01c78c5addb63ff124/","Intermediate",20,2019-06-13,"I will provide 2 different sheets and based on the criteria need you to pull and display the correct data based on it matching data from the other sheet.",NA,NA,"$0 ","0.00 Stars, based on 1 feedback","United States",NA,0,1
"73","TV Data Analysis","https://www.upwork.com/job/Data-Analysis_~017f2fb9c42acd485c/","Intermediate",NA,2019-06-13,"Build an excel that will be able to connect between to layers of data - traffic and purchases from a website TV spots","Microsoft Excel",NA,"$40 ","5.00 Stars, based on 1 feedback","Israel",NA,5,1
"74","Editor for Financial Blog Postings","https://www.upwork.com/job/Editor-for-Financial-Blog-Postings_~017fc670f20de7a03a/","Intermediate",NA,2019-06-13,"I have been in the financial world for a long time, I post regularly and I need someone to edit and check statistics. Please include the word muffin in your application.","Fact Checking, Internet Research, Financial Services",NA,"$6k+ ","4.99 Stars, based on 17 feedbacks","United States",NA,4.99,17
"75","Graphic Designer for Event Booklets, Infographics & Logos","https://www.upwork.com/job/Graphic-Designer-for-Event-Booklets-Infographics-amp-Logos_~0111db06826e798d40/","Intermediate",NA,2019-06-13,"We run a marketing agency and we need help with logo concepts, tweaks to old logos that need to be refreshed, and design ideas for clients. We also need help updating our live conference booklets, graphics for events coming up, and other event-related graphic design work. We would like someone with 7-10+ years of graphic design experience. less","Infographics, Book, Adobe Photoshop, Website Asset, Corporate,  ",NA,"$200k+ ","5.00 Stars, based on 10 feedbacks","United States",NA,5,10
"76","Calculate coordinate position of target based on relief and camera info (GIS, Google Maps Api, lens)","https://www.upwork.com/job/Calculate-coordinate-position-target-based-relief-and-camera-info-GIS-Google-Maps-Api-lens_~010c4771f709be60d2/","Expert",5,2019-06-13,"I'll provide informations about camera. I need as the main result the lat/long of target. Using the relief is important on this job, since mountains can change the distance and result. You can use some service like Google Maps Api to do this job. DETAILS Information provided: - Camera Pan; - Camera Tilt; - Camera Zoom; - Camera lens information; - Camera altitude; - Camera Lat/Long; - Camera image size; - X/Y of target on image. If something else more is needed to generate the results, consult me. Expected results: - Pan and Tilt of target position; - Based on the relief, calculate the distance from the camera to the target; - Based on the relief, return Lat/Long of the target. Result format (JSON): { ""pan"": 22.3, ""tilt"": 7.4, ""distanceInMeters"": 3408.43, ""latitude"": -31.545454, ""longitude"": -52.645656 } About accuracy, this is the maximum distance difference: • <= 1km: 50 meters • 1km to 5km: 75 meters • 5km to 10km: 120 meters • 10km to 15km: 160 meters • >= 15km: 200 meters less","GISC",NA,"$10k+ ","5.00 Stars, based on 1 feedback","Brazil",NA,5,1
"77","Development of MVP for Music-Based Data Analytics Company","https://www.upwork.com/job/Development-MVP-for-Music-Based-Data-Analytics-Company_~012593d839718b737a/","Intermediate",1500,2019-06-13,"We are looking for someone who is a go-getter and committed to help us develop the minimum viable product for our startup. We want people smarter than us to help us know better about our product and help make it a success.","BigQuery, Google Analytics, Python, Data Visualization, Web Design",NA,"$0 ","No feedback yet","India",NA,NA,NA
"78","Venture Capital / PE AI project for analysing portfolio","https://www.upwork.com/job/Venture-Capital-project-for-analysing-portfolio_~013a83f8748b9817cb/","Intermediate",NA,2019-06-13,"We are developing a Salesforce based portfolio management system for a VCT/ VC and PE fund manager. We are in need of somebody with excellent AI skills, but also an expert in investing, stocks and shares and venture capital. The person will work wi ... more","Python",NA,"$7k+ ","4.77 Stars, based on 7 feedbacks","United Kingdom",NA,4.77,7
"79","Annuity Calculator","https://www.upwork.com/job/Annuity-Calculator_~015bf071f5555617c1/","Intermediate",30,2019-06-13,"SHORT BACKGROUND INFO We create ready-to-use Excel templates and Custom spreadsheet solutions for global markets and market them via our website. We are constantly accepting new teammates who are extremely skilled in Excel and VBA. So, if we like the quality of your work, we will offer many new tasks after this one. To understand the structure of our templates please check our website below. https://www.someka.net/ WHAT IS THIS JOB ABOUT? We need an Annuity Calculator template for our users to calculate their pay out schedule and see their annuity information clearly This job is about creating a generic + unique + Ready-To-Use Invoice Template in Excel and writing a short product description about it. See the attached job brief for more info. IN YOUR PROPOSAL • Please don’t copy-paste your pre-made texts, write a unique application for this job • Simply explain how you are going to do the job • When can you deliver the job • Share a few nice looking samples you have done in Excel INFO • Due to the time-zone issues, we only accept applications from Europe (West + East). (Also, full time freelancers are also preferred for the upcoming jobs as mentioned above) • Please write the keyword in the beginning of your application so that we understand you've read the job description (keyword is in the attachment) Thanks! less","Microsoft Excel",NA,"$8k+ ","4.99 Stars, based on 11 feedbacks","Turkey",NA,4.99,11
"80","Talent Acquisition Consultant/Psychometric Testing Creator","https://www.upwork.com/job/Talent-Acquisition-Consultant-Psychometric-Testing-Creator_~01b0ed387439cee8e0/","Expert",NA,2019-06-13,"We are a company that provides pre-employment testing for small businesses offering a new holistic approach to candidate testing We are looking for a psychology/HR professional that can help us with creating custom NEO-PI style or similar personality testing applied to job skills. Need custom tests based on the Big 5 Model to test: Neuroticism (subsets: anxiety, angry hostility, depression, self-consciousness, impulsiveness and vulnerability) Extroversion (subsets. warmth, gregariousness, assertiveness, excitement seeking, positive emotions and activity) Agreeableness (subsets: trust, straightforwardness, modesty, compliance, altruism, tender-mindedness) Conscientiousness (subsets: competence, order, dutifulness, self-discipline, deliberation and achievement-striving) Openness (subsets: fantasy, aesthetics, feelings, actions, ideas and values) We need the test creator to come up with indirect questions instead of normal test questions since they are usually too direct and the candidate is likely to answer as they think it might suit them best to get the job and not necessarily truthfully. Test creator needs to report in detail what answering yes/no on each singular question may mean in job performance/work environment context, as well as scoring high/low on each subset as well as each of the 5 main traits. (this is a duplicate post from our other upwork account, if you already applied before, please skip this one) less","Psychometrics",5,"$100k+ ","4.93 Stars, based on 130 feedbacks","Portugal",NA,4.93,130
