"","jobtitle","joblink","jobLevel","budget","date","content","tags","numberOFfreelancers","totalspent","customerscore","country","customertype","score","Nfeedback"
"332","Expert Firearms & Guns Writer Needed","https://www.upwork.com/job/Expert-Firearms-amp-Guns-Writer-Needed_~01b8078b01359c2d00/","Intermediate",1000,2019-07-03,"Are you an experienced article writer and passionate about firearms? Do you have a passion for guns/2nd amendment/hunting, and know that a clip and a magazine aren't the same damn thing? If so, we've got work for you. We are looking for an experienced article writer to help us create a series of articles related to firearms. When applying, please state your rate per thousand words along with your favorite firearm and why. Also send a relevant sample. less","Blog Writing, Content Writing",3,"$40k+ ","4.61 Stars, based on 46 feedbacks","United States",NA,4.61,46
"333","Please edit our existing Logo & we need to create a Letter Head","https://www.upwork.com/job/Please-edit-our-existing-Logo-amp-need-create-Letter-Head_~0131ea3a9b251b8a5d/","Intermediate",15,2019-07-03,"Hi there! We're looking for someone to tweak our logo a bit please! It's currently Anoela Cards and there are a few things about it that we would not want to change please. We love the cloud and the colour. If possible, would you also be able to let us know the exact pantone colour of our logo for branding purposes. We have now rebranded as Anoela which has a number of subsidiaries such as Anoela Cards, so we'd like to have a generic Anoela Logo which we can add the second half of the subsidiaries to, as they are created. E.g. Anoela Candy, Anoela Water or Anoela Club. We would also need the person to please come up with a creative but minimalistic letter head/any other document branding. Thank you! We'd prefer to someone that has some history of working with brands. A brand that we know has done something similar is the Virgin group (if you're looking for inspo). less","Brand Guidelines",NA,"$3k+ ","4.88 Stars, based on 57 feedbacks","United Kingdom",NA,4.88,57
"334","Wordpress website","https://www.upwork.com/job/Wordpress-website_~01a6cd46163f7c8aa5/","Intermediate",45,2019-07-03,"Hey i need someone to help me design my wordpress website i already have all the texts i need and only need a 3 page site, i also already have template bought",NA,NA,"$2k+ ","5.00 Stars, based on 12 feedbacks","United States",NA,5,12
"335","Data entry/extraction","https://www.upwork.com/job/Data-entry-extraction_~01fb374480c28af8f3/","Entrylevel",20,2019-07-03,"I am looking for someone to extract data from a word/pdf and enter it into an excel file. I have provided 2 sources to exact the data from (pdf/word doc) use which ever one is easiest . I have provided the excel sheet to add the data to and have started the first 2 entries to show examples. less","Data Entry, Databases",NA,"$700+ ","4.26 Stars, based on 14 feedbacks","United Kingdom",NA,4.26,14
"336","Front-End Development","https://www.upwork.com/job/Front-End-Development_~010edfcee9eeb4b5c2/","Intermediate",20,2019-07-03,"Design converted to HTML that can be displayed in all email clients. Looking for: Someone with experience writing HTML for emails https://adobe.ly/2LdXF3E","HTML",NA,"$0 ","No feedback yet","United States",NA,NA,NA
"337","Cutting an existing video into several pieces","https://www.upwork.com/job/Cutting-existing-video-into-several-pieces_~01a7ce3b52a0985485/","Entrylevel",20,2019-07-03,"I will need your help with cutting a 2 hours lasting video into small videos. Within the video someone is performing on the stage. And the person would love to have those videos seperately for sharing. - 22:06 - 26:25 (""Vater"") - 43:10 - 46:30 („Gras“) - 50:00 - 52:43 („Keine Zeit mehr“) - 56:32 - 1:00:33 („Soll sein“) - 1:42:30 bis 1:43:15 (""Schlusstext"") The first four videos are outtakes of the song the band is performing. The last one is a speach. Feel free to give at the beginning or end of each video an additional couple of second or less if you have the feeling it makes the video much smoother. If you are hired, I will provide you a Google Drive where you can download the source file and where you should please upload the edited final files. Please name them with the corresponding quoted text above (e.g. ""Vater"") We will need the video in the same quality as the source video is. So please don't do any trashy rendering. Thanks. AFTER FINISHING THE ABOVE THE TASK I ask you to take the whole source file and render it in a quality which is suitable for streaming on Youtube. less","Adobe After Effects",NA,"$1k+ ","5.00 Stars, based on 23 feedbacks","Germany",NA,5,23
"338","Create B2B HTML5 Ads","https://www.upwork.com/job/Create-B2B-HTML5-Ads_~01f0adc52682945298/","Intermediate",NA,2019-07-03,"Create a set of HTML5 Ads, we will provide the copy and visual direction","Retargeting, Goolge AdWords",NA,"$400+ ","5.00 Stars, based on 2 feedbacks","Canada",NA,5,2
"339","Need help with Page Speed Optimization for Wordpress Website","https://www.upwork.com/job/Need-help-with-Page-Speed-Optimization-for-Wordpress-Website_~0146008b9b04c58518/","Intermediate",NA,2019-07-03,"Need help with the following: 1. Analyze side load speed and determine problem areas 2. Help with the following: > re-configure WP Super Cache settings according to this article > combine your CSS and JS files > look into HTTP Cache-Control (specifically max-age) and Expires headers > optimize cache in .htaccess file. 3. Optimize the speed with which our above-the-fold content begins to render 4. Optimize the time it takes for above-the-fold content to be visually complete and interactive. 5. Optimize the average time at which visible parts of our page are displayed relative to the average time at which visible parts of our competitor’s page are displayed. less","Java, JavaScript, PHP",NA,"$8k+ ","4.87 Stars, based on 20 feedbacks","United States",NA,4.87,20
"340","Warm Up New Email Domain","https://www.upwork.com/job/Warm-New-Email-Domain_~01da2a9b9e0b7badd4/","Intermediate",100,2019-07-03,"We have two new email domains that we need to warm up before using for outbound reach-out to prospects. I have completed the steps outlined here but emails are still going to Spam as the domains were created a couple of days ago. https://support.apollo.io/hc/en-us/articles/115003682011-Improve-Your-Email-Deliverability I need an expert in Google Suite to ensure that emails sent are not labelled as Spam. Ideally, we need to have these domains ready in one month. less","Email Deliverability, Email Support, Email Technical Support, ",NA,"$7k+ ","4.94 Stars, based on 22 feedbacks","United States",NA,4.94,22
"341","Building Facebook Ads","https://www.upwork.com/job/Building-Facebook-Ads_~01eb9002e664dfebda/","Expert",NA,2019-07-03,"Look for an expert in Facebook ad building and targeting for our products. Camera Straps, Sunglass Straps, and Dog leashes and collars. Must have a track record of previous successful campaigns and clients.","Facebook Marketing, Instagram Marketing,  ",NA,"$0 ","No feedback yet","United States",NA,NA,NA
"342","PHP version downgrading for Drupal 5.23","https://www.upwork.com/job/PHP-version-downgrading-for-Drupal_~0192a68e591eb4dd4a/","Expert",NA,2019-07-03,"Need Plesk 11 to run PHP 5.3.3 and one Drupal 5.23 site to use php 5.2.6.","Custom PHP",NA,"$1k+ ","4.95 Stars, based on 7 feedbacks","Canada",NA,4.95,7
"343","Data Entry Work - Google Sheets or Microsoft Excel experience needed","https://www.upwork.com/job/Data-Entry-Work-Google-Sheets-Microsoft-Excel-experience-needed_~01f80b89a4cc30b03c/","Intermediate",35,2019-07-03,"I would like you to input data into a shareable Google Sheets document. The data will be extracted from a website and input into our Google Sheets document. Almost anyone can do it. There are about 690 submissions that need to be done for this particular job. Thanks for looking! less","Data Entry",NA,"$0 ","No feedback yet","United States",NA,NA,NA
"344","I need Facebook and IG posts for finance business","https://www.upwork.com/job/need-Facebook-and-posts-for-finance-business_~01fca0a26d12650f7a/","Entrylevel",NA,2019-07-03,"I need Facebook and Instagram posts. They must look good and have good messages that are relevant to my business. Additionally, I also need US ""likes"" for those accounts. Please tell me how much you will charge for each post. I have FIVE websites/accounts. If you are good and affordable, this can work. If you can provide recent links of FB or IG accounts that you have created content for, this will help me choose you. Thank you! less",NA,NA,"$10k+ ","4.89 Stars, based on 108 feedbacks","United States",NA,4.89,108
"345","Developer needed for Visual Timekeeping software","https://www.upwork.com/job/Developer-needed-for-Visual-Timekeeping-software_~019dd94126abe83ab8/","Intermediate",NA,2019-07-03,"We are looking to develop a simple timekeeping software loosely based around our company workflow. The intent is to be able to have visual based software with simple UI that can produce reports based off a few filters. It would be nice to have mul ... more",NA,NA,"$0 ","No feedback yet","United States",NA,NA,NA
"346","Creating layout using bootstrap for a php website","https://www.upwork.com/job/Creating-layout-using-bootstrap-for-php-website_~01c7cbfb4c80e41338/","Intermediate",20,2019-07-03,"creating an php website layout using bootstrap framework 1. DOnt have to create everything, 2. Create ( header and menus >> should be responsive for desk and mobile ). 3. Create footer too. Here is the sample website >> http://www.intchat.com I ne ... more","CSS, HTML, JavaScript",NA,"$2k+ ","5.00 Stars, based on 25 feedbacks","India",NA,5,25
"347","Graphics Designer","https://www.upwork.com/job/Graphics-Designer_~0131a069a5e7345b8c/","Entrylevel",NA,2019-07-03,"Photo Manipulation Photo Retouching Logo Design Visiting Card Graphics Design Background Removal Music Album Poster Design Matte Painting Cover for Social Media. Wedding Photography Touch ups Banners Adds Resizing Image Sharpning Color Correction Lighting Adjustment Photo Merging Timeline GIF Editing Color Swap Black and White to Color Collag Editing less",NA,NA,"$0 ","No feedback yet","India",NA,NA,NA
"348","Re-Design for Company Profile","https://www.upwork.com/job/Design-for-Company-Profile_~011baf427e6aeded2f/","Expert",1500,2019-07-03,"We are looking for a creative freelancer to re-design our company profile, only designers with similar job experience are qualified this time.",NA,NA,"$0 ","No feedback yet","Oman",NA,NA,NA
"349","Looking for a experienced Angular/Symfony developer","https://www.upwork.com/job/Looking-for-experienced-Angular-Symfony-developer_~01c5b73d0b80ceb05e/","Expert",NA,2019-07-03,"Our company is looking for Senior Symfony/Angular developer. You must proficient in: -angular 7, typescript -Symfony -must know webpack/gulp -must know AWS knowledge -must have good communication skill -must be able to start right now This project must be started asap. If you can start this project right now, don't hesitate to bid this job less","AJAX, AngularJS, CSS, HTML, jQuery, API,   ",NA,"$100+ ","5.00 Stars, based on 5 feedbacks","Brazil",NA,5,5
"350","Need efficient data entry form designs","https://www.upwork.com/job/Need-efficient-data-entry-form-designs_~01b6a3a09cfa8ab8aa/","Intermediate",400,2019-07-03,"I am open to the best in breed of user experience design. Please create a mockup/prototype/wireframe showing what the most efficient data form would look like in your expert opinion.","Interaction Design, Usability Testing, Software Design",NA,"$200+ ","5.00 Stars, based on 1 feedback","United States",NA,5,1
"351","Collect contact information","https://www.upwork.com/job/Collect-contact-information_~013f9644fb7f850606/","Intermediate",200,2019-07-03,"We are an SEO firm seeking to contact owners. We need help with getting contact information for owners and CEOs of companies in the Vape, CBD, Beauty, Dispensaries in California, and Cosmetic. Sometimes, the contacts are incredibly illusive and difficult to find correct contact information for. When our associates mark the contact information as incorrect, we'd like to hire an individual to seek out the correct contact information. You will use tools like company website, linkedin, facebook, etc. I will be able to provide the data mentioned above, in hopes you can discover the correct information. Phone numbers are a big plus. Please let me know if you've completed something similar to this before and how you'd discover the correct contact information. We need a total of 1000 contacts within 5 days. less","CRM, Data Entry, Data Scraping, Lead lists, ",NA,"$300+ ","5.00 Stars, based on 1 feedback","United States",NA,5,1
"352","Looking for someone who can do bulk SKIP TRACE for a few thousand BUSINESS NAMES.","https://www.upwork.com/job/Looking-for-someone-who-can-bulk-SKIP-TRACE-for-few-thousand-BUSINESS-NAMES_~018391892bdfd40c59/","Expert",50,2019-07-03,"Skip Trace for phone numbers and email address of some business names. We haven't come up with an exact number yet but should be somewhere between 5-10k contact names (could me more.)","Skip Tracing",NA,"$400+ ","5.00 Stars, based on 2 feedbacks","United States",NA,5,2
"353","Digital Paid Advertising Expert Needed","https://www.upwork.com/job/Digital-Paid-Advertising-Expert-Needed_~0187d329541f341989/","Intermediate",500,2019-07-03,"We’re looking to provide experienced paid advertising experts with a steady flow of well paid work. We specialise in the health and wellness industry and provide our clients with Facebook advertising expertise and strategy. Our main goal is to help ... more","Facebook Marketing, Google+ Marketing,  ",NA,"$60 ","5.00 Stars, based on 2 feedbacks","United Kingdom",NA,5,2
"354","Press Junket Interview","https://www.upwork.com/job/Press-Junket-Interview_~015926f035301bfb7b/","Expert",NA,2019-07-03,"Hello, Here's my bio : Simo Benbachir is none other than the first Moroccan TV reporter-who also happens to be the first to cover Hollywood's largest events like the Grammys and the Oscars. He is notable for interviewing well-known celebrities and delivering a most sought-after opinions and fresh points of view to his Arabic audience. When Simo Benbachir was still young, he started working as a reporter for 2M, the second Moroccan TV channel. After some time, he switched over to a Tunisian-based channel,Nessma TV and later on, to B-Beirut, a Lebanese TV channel whose transmission went as far as the whole of Arab world. He became the showbiz reporter of Alrabiya News English in year 2014, and has remained put ever since. The events he covers are those that are internationally full of glamour, particularly the US based ones. So far, he remains Hollywood's only Moroccan TV reporter. Several European magazines has ranked Simo Benbachir as the most popular Moroccan TV personality. He is one of the faces of Kastiani magazine and was described as ""The Reporter of Star, The Star of Reporters"". In addition to that, the Version Homme magazine lists him among the most influential Moroccan Media personalities and he graces their cover page. In 2017, he received the Brukmer Press Honorary Award in Belgium. He has to his many credits, the skill for making his interviewers relaxed to the point of being friendly with him and sharing their secrets. This is the major reason he is most sought-after. Many youngsters in Arab and Morocco look up to this hood-Hollywood star for motivation. What do I need ? A publicist to get me the gigs, interviews In LA, covering the events etc less","Media Relations",NA,"$100+ ","No feedback yet","United States",NA,NA,NA
"355","Web Development using Entity Framework - start ASAP","https://www.upwork.com/job/Web-Development-using-Entity-Framework-start-ASAP_~013966bbbbf0fe2bda/","Intermediate",NA,2019-07-03,"To do: - Update/Enhance UI based from give design images - Update existing reports with static data to dynamic data using RDLC - Debug system errors - Deploy application in test server Requirements: - Adaptable to changes - Good attitude - Good communication skills - Experienced Full Stack .Net EF Web Developer/Engineer less","Bootstrap, CSS, Database Design, .NET Framework,   ",2,"$0 ","No feedback yet","Philippines",NA,NA,NA
"356","Edit WordPress Header and Footer - Advanced Coding knowledge needed","https://www.upwork.com/job/Edit-WordPress-Header-and-Footer-Advanced-Coding-knowledge-needed_~01503654ce75d74c14/","Intermediate",NA,2019-07-03,"I want to edit the header and footer of just one page: PromoForGood.com/respitality. I need the header and footer to stay the same on every other page but I would like to remove the header and edit the footer just on the respitality page. The website is hosted on BlueHost and the interface is WordPress. The theme is Creatica. Please confirm if the attached image will be possible to create on the page without breaking the functionality of the tabs and content on the rest of the website. I only need this page changed for now. Further work could be needed as the business grows. Please explain to me how long these changes will take you to make. less","WordPress",NA,"$0 ","No feedback yet","United States",NA,NA,NA
"357","Fashion Sketch Artist Required","https://www.upwork.com/job/Fashion-Sketch-Artist-Required_~010932095c9a58dc85/","Intermediate",13,2019-07-03,"Hi, I need a fashion sketch artist who can bring life our designs. Please let me know if you're interested and also of your availability",NA,NA,"$600+ ","5.00 Stars, based on 1 feedback","United Kingdom",NA,5,1
"358","Frontend redesign of my website","https://www.upwork.com/job/Frontend-redesign-website_~016f50456b40d397bb/","Intermediate",100,2019-07-03,"I need a front-end developer (web designer) to redesign my current and existing website.","CSS, HTML",NA,"$0 ","No feedback yet","Serbia",NA,NA,NA
"359","Graphic Designer for book illustration","https://www.upwork.com/job/Graphic-Designer-for-book-illustration_~01729fc35812a9f8fd/","Intermediate",500,2019-07-03,"I need a graphic designer or illustrator to create book illustrations for a Christian children’s book to be published. Please include in your submission your best illustration or design work. If you submitted a proposal previously for this job, pleas ... more","Animation, Character, Storybook, Cartooon,  ",NA,"$1k+ ","4.94 Stars, based on 7 feedbacks","United States",NA,4.94,7
"360","Animated “How it Works” Video/Sales aids","https://www.upwork.com/job/Animated-How-Works-Video-Sales-aids_~01480e35e74de632a6/","Intermediate",50,2019-07-03,"Our company AccrediRent helps tenants and landlords report rent payments to the credit bureaus. We are looking for an animated video or “white page” style video set to use on our website as a “How it Works” and sales aide This job was posted from a mobile device, so please pardon any typos or any missing details. less","Animation, Motion Graphics, Video Editing, ",NA,"$100+ ","4.93 Stars, based on 2 feedbacks","United States",NA,4.93,2
"361","Rewriting / create new unique articles in Latvian (Latvia)","https://www.upwork.com/job/Rewriting-create-new-unique-articles-Latvian-Latvia_~0106ab15e879bbd23c/","Entrylevel",100,2019-07-03,"We are looking for Latvian writer from Latvia. First step: to rewrite 19 articles/18 pages. After we see good results we will continue with more orders/articles. Find attached texts to be rewritten and to make it unique. What to do: - Rewrite attac ... more","Latvian, Article, Blog Article, Financial Services",NA,"$500+ ","No feedback yet","Bulgaria",NA,NA,NA
"362","Logo - OnSite Power Control","https://www.upwork.com/job/Logo-OnSite-Power-Control_~0146c3faeebfa14535/","Intermediate",25,2019-07-03,"I need a company logo design for OnSite Power Control.","Infographics, Landing Pages, Website Asset, Corporate,   ",NA,"$0 ","No feedback yet","United States",NA,NA,NA
"363","Telesales","https://www.upwork.com/job/Telesales_~01240e50edb81561e3/","Expert",10000,2019-07-03,"Are you good on the phone? We are looking for a lead generator appointment setter for Solar Leads. Each appointment you make $500.00 USA must be able to start immediately, must have a clear speaking voice interviews will be held via WhatsApp chat Leave your contact info. This job was posted from a mobile device, so please pardon any typos or any missing details. less","Cold Calling, Data Entry, Email Marketing,   ",NA,"$700+ ","5.00 Stars, based on 2 feedbacks","United States",NA,5,2
"364","Resume design","https://www.upwork.com/job/Resume-design_~01f9e6850d041e2679/","Expert",NA,2019-07-03,"Take the contents of my resume and reformat it to match the design of another resume that I'll provide you with.","Resume Design",NA,"$1k+ ","4.82 Stars, based on 13 feedbacks","United States",NA,4.82,13
"365","Video creator for YouTube channel","https://www.upwork.com/job/Video-creator-for-YouTube-channel_~01759281defae38157/","Entrylevel",NA,2019-07-03,"- Responsible approach to work. - <U+0421>reativity. - <U+0421>ommunicability.","Music Video",NA,"$0 ","No feedback yet","Belarus",NA,NA,NA
"366","CFA editor/copyeditor needed for ""meta editing"" blog post for headline improvement & ""zing""","https://www.upwork.com/job/CFA-editor-copyeditor-needed-for-quot-meta-editing-quot-blog-post-for-headline-improvement-amp-quot-zing-quot_~01d9ec4ddf9c32f2f1/","Expert",NA,2019-07-03,"Hi, I'm looking for a CFA Charterholder who has an English/creative background to scan a 1300 word blog describing the accounting concept of factoring/reverse factoring that has already been edited for CFA style. It does NOT need editing in that sense. I'm looking for someone who can recommend several more interesting titles and subheads (4-5) than the ones currently being used. Note: Puns and most humor won't work for our international audience, many of who have ESL, nor do idiomatic/jargon words. I need fast turnaround on/before Friday 5 July 2019 and wouldn't expect a highly creative person to take more than 2 hours. If successful, could lead to more similar work. I will be able to post the edited blog and commissioned image by EOD. less","Search Engine Optimization (SEO, Headlines",NA,"$0 ","No feedback yet","United States",NA,NA,NA
"367","German Writers Needed","https://www.upwork.com/job/German-Writers-Needed_~0162fc24203b00118c/","Intermediate",20,2019-07-03,"Hi there! We are looking for German native writers to work on a regular basis. We order articles for online gambling niche. These can be landing pages, blog articles, casino reviews, slot reviews or provider reviews. What we expact from the writers: German native Good writing skills in German Great spelling and grammar Good English (briefings for articles are in English) Internet research We are glad to receive your applications! Please write your price per word in dollar cent. GERMAN TRANSLATION Hallo! Wir suchen für langfristige und flexible Zusammenarbeit deutschsprachige Texter/innen (Muttersprachler). Beauftragt werden verschiedene Arten von Texten zum Thema Online-Gambling. Das können Artikel für Landingpages, Blogartikel, Casino-Reviews, Slot-Reviews oder Hersteller-Reviews sein. Was wir von den Autoren erwarten: Deutsch - Muttersprache Gute schriftliche Ausdrucksweise auf Deutsch Einhaltung der Rechtschreibung Gute Englischkenntnisse (Briefings zu Artikeln sind auf Englisch) Gründliches Recherchieren Wir freuen uns sehr auf Ihre Bewerbungen (mit der Angabe von Ihrem Preis pro Wort in Dollarcent)! less","German",NA,"$30k+ ","4.87 Stars, based on 23 feedbacks","Ukraine",NA,4.87,23
"368","Looking for mobile app developer IOS, Android","https://www.upwork.com/job/Looking-for-mobile-app-developer-IOS-Android_~010af474eb29b3d55b/","Intermediate",1500,2019-07-03,"Looking for mobile app developer to create an app on android and IOS.","In-App Purchases, User Authentication, User Profile Creation, ",NA,"$1k+ ","5.00 Stars, based on 1 feedback","India",NA,5,1
"369","Logo Design","https://www.upwork.com/job/Logo-Design_~01e36b7b40bb391016/","Expert",100,2019-07-03,"I need a logo created for my business. I need it in EPS Vector Format. Transparent Background, 300+ dpi. My business is Caressing Care. Id like a mandala created with two C's facing each other camouflaged with the mandala tiles around it. I'd like the ""C"" one color and the mandala multicolored like tye dye. less",NA,NA,"$0 ","No feedback yet","United States",NA,NA,NA
"370","Academic Paper & Annotated Bibliography","https://www.upwork.com/job/Academic-Paper-amp-Annotated-Bibliography_~011ce331eeada2136d/","Expert",150,2019-07-03,"Looking for someone proficient to assist in academic writing (7-8 double spaced) and a annotated bibliography. As freelancer are screened more information will be provided.","Education, Academic Writing, Citation Styles",NA,"$5k+ ","4.89 Stars, based on 34 feedbacks","United States",NA,4.89,34
"371","React component from js file","https://www.upwork.com/job/React-component-from-file_~01479ddccef1daf3f8/","Intermediate",15,2019-07-03,"Hi everyone, I'm looking for a React.js developer to create a component from this js library: https://github.com/Corentinfardeau/horizontal-scroll I need this to be completed within the next couple of hours","React.js, TypeScript",NA,"$6k+ ","4.99 Stars, based on 19 feedbacks","United Kingdom",NA,4.99,19
"372","10 min help to test phone verification providers in Vietnam","https://www.upwork.com/job/min-help-test-phone-verification-providers-Vietnam_~01029de07145814efa/","Entrylevel",5,2019-07-03,"- I need help for 10 - 15 minutes to test different providers of phone verification services in Vietnam - I will test the provider by sending you a code to your phone number - You need a smartphone - You need to be in Vietnam",NA,NA,"$10k+ ","4.84 Stars, based on 93 feedbacks","United States",NA,4.84,93
