"","jobtitle","joblink","jobLevel","budget","date","content","tags","numberOFfreelancers","totalspent","customerscore","country","customertype","score","Nfeedback"
"938",".NET developer with experience in React to join our team and evolve enterprise application","https://www.upwork.com/job/NET-developer-with-experience-React-join-our-team-and-evolve-enterprise-application_~01af19e61dc12f3493/","Intermediate",NA,2019-07-03,"We have an enterprise apps built with .NET 4.7 and .NET Core 2+ We need an experienced .NET developer to join our team remotely and help to evolve the app Having English level B2 (certificate not required) and good communication skills are mandatory Primary work is related to the back-end. But having front-end experience with React is a huge advantage For UA residents Please send your CV when applying less","ASP.NET, .NET Framework, API, API Integration, Amazon Web Services, ",NA,"$0 ","No feedback yet","Ukraine",NA,NA,NA
"939","Designer needed for 3D bottle pictures","https://www.upwork.com/job/Designer-needed-for-bottle-pictures_~01b6e61c81d201f96c/","Intermediate",NA,2019-07-03,"We are a Canadian e-commerce company in the health supplements market seeking a freelancer to design realistic supplement bottle images for some of our products. We have attached: 1. Our label design for these bottle pics 2. A previous attempt at designing these pictures, which is not good enough as it looks too digital 3. Some competitor's pics to show what we are looking for We would like multiple images of the same bottle, showing each side of the label. less","Adobe InDesign, Adobe Photoshop, Adobe Illustrator, ",NA,"$6k+ ","4.90 Stars, based on 18 feedbacks","Canada",NA,4.9,18
"940","website avada wordpress","https://www.upwork.com/job/website-avada-wordpress_~01c89e0a74545c6f4d/","Entrylevel",300,2019-07-03,"need to develop a website per crypto business have to make site new from a scratch so all graphic , text , and so on is free to style of developer pages is less than 10 (about/who we are/ contacts/mission / etc) have to be optimized (tag, anchortext, ... more",NA,NA,"$0 ","No feedback yet","Italy",NA,NA,NA
"941","Business Plan writer needed for private lender","https://www.upwork.com/job/Business-Plan-writer-needed-for-private-lender_~01f48c5e95e89794e4/","Expert",750,2019-07-03,"Private money lender looking to grow portfolio through marketing and also establish lending underwriting guidelines to more efficiently and safely lend money.","Business Planning, Financial Services",NA,"$0 ","No feedback yet","United States",NA,NA,NA
"942","Customer support agent to answer calls and e-mails in Brazilian Portuguese","https://www.upwork.com/job/Customer-support-agent-answer-calls-and-mails-Brazilian-Portuguese_~0144d81c1e26ff4278/","Intermediate",150,2019-07-03,"I am looking for someone to help me on a monthly basis with my webshop customers. Your tasks will be to answer calls and e-mails from customers regarding: - The delivery of orders - Questions about the products before ordering - How to install the products once they have received them The products are bathroom and kitchen faucets. It would be preferred if you know something about that. I am looking for someone who is a practical kind of person and who knows how to talk to people in a way that they feel heard and understood. The experience for the customer should be that we take care of whatever their concern is with empathy and swift action. To begin with I am interested in having you onboard mon-fri at a set time of day, where you will answer calls and e-mails (maybe also Whats App) and communicate with me about what is happening in English. My monthly budget for this position (to begin with) is 150 USD a month. Please give me your suggestions as to how you believe we can make this happen. less",NA,NA,"$100+ ","5.00 Stars, based on 7 feedbacks","Denmark",NA,5,7
"943","GIF Logo conversion to Vector Format","https://www.upwork.com/job/GIF-Logo-conversion-Vector-Format_~01b35976f1e794f976/","Entrylevel",25,2019-07-03,"We have a GIF format logo that we would like converted to a vector format so that we can scale and modify as needed. Deliverable will be an EPS file containing an exact match to the supplied raster graphic.",NA,NA,"$0 ","No feedback yet","United States",NA,NA,NA
"944","Conversion Rate Optimization Specialist Wanted","https://www.upwork.com/job/Conversion-Rate-Optimization-Specialist-Wanted_~011fc2be1d9ecdeacd/","Expert",NA,2019-07-03,"We are looking for someone to help with our CRO on our website. We are ideally looking for a long term monthly engagement. This post is to get qualified applicants. All shortlisted applicants will be contacted where I will explain our objectives and go into our site in more detail/ less","Campaign Management, Campaign Optimization",NA,"$60k+ ","4.99 Stars, based on 98 feedbacks","Canada",NA,4.99,98
"945","Need Shopify Web Developer - Multiple Project Possibilities","https://www.upwork.com/job/Need-Shopify-Web-Developer-Multiple-Project-Possibilities_~014138848c3efc0383/","Expert",250,2019-07-03,"Do you have expert-level experience in web development for ecommerce? Are you tired of sending countless proposals and searching for jobs? Hi, my name is Harry from Obtain Digital and I am looking to establish a relationship with a reputable web developer to give projects to. My team and I will take care of the proposals, leads, and closing sales, all you must do is finish the project and get paid. Makes it way easier for you to focus on your craft. Please submit a proposal with the phrase ""I'm Interested"" in the beginning, and provide your past work with it. less","Shopify",NA,"$0 ","No feedback yet","United States",NA,NA,NA
"946","Lead Generation Specialist","https://www.upwork.com/job/Lead-Generation-Specialist_~01d2e2158d2721159c/","Entrylevel",NA,2019-07-03,"Hi, I'm a newly created startup that is searching for companies (mainly in the U.S.) in need of software development assistance. The goal is to then connect them with software houses that can handle their project. For this job, I'm looking for someone with 1+ year of experience in lead generation via linked in and sending cold emails. I need each email to be partially personalized. Basically to just write a few words about a feature or a specific thing about the company's product/ service that you find interesting. We want the prospect to know there's a real human behind this email which increases the chances for a response. As for generating leads, we will use a tool called Interseller which is capable of finding contact info from Linkedin. I need someone who has a good level of competence searching for leads via Linkedin Sales Navigator using boolean search. Interseller will take care of the rest. You will not need to transfer data to any crm, as everything is automated. Ideally, you will have previous experience generating leads for software houses, SaaS/ tech companies. I look forward to speaking if you love the challenge of prospecting and writing emails that get responses! less",NA,NA,"$0 ","No feedback yet","United States",NA,NA,NA
"947","Web developer need to create an ecommerce website to sell digital products","https://www.upwork.com/job/Web-developer-need-create-ecommerce-website-sell-digital-products_~01362fb2cc7a0dbb93/","Intermediate",1000,2019-07-03,"We are looking to design and create an e-commerce website to sell digital gaming codes for instant delivery to the customers. The website should have the following options: 1) Ability to store digital codes at the back end 2) Connect to the API of ... more",NA,NA,"$2k+ ","4.74 Stars, based on 3 feedbacks","United States",NA,4.74,3
"948","News writers needed for education portal","https://www.upwork.com/job/News-writers-needed-for-education-portal_~0157e5be33ed173ebe/","Intermediate",100,2019-07-03,"Hello, We are looking for writers to produce news for an education news portal. The job is simple: everyday, we will send you links to 2 news stories. You have to rewrite them with a fresh perspective and send them back. 300-350 words at most per article. Basically, 2 300-350 word articles every day of the month, in British English (not US). Very straight-forward task. Should not take more than 30-45 mins daily. We are looking to hire initially for a month but, if the results are good, we will look at making this an ongoing project. If you desire, you will also get a byline and be credited as an author on the website for the stories you produce. If you're interested, please respond mentioning how this role would suit you. Thanks, Hari less","English - England, Blog Article, Web Content",NA,"$1k+ ","4.87 Stars, based on 10 feedbacks","United Kingdom",NA,4.87,10
"949","Need chrome app developer familiar with Poshmark","https://www.upwork.com/job/Need-chrome-app-developer-familiar-with-Poshmark_~011d9d928a089e64b4/","Expert",30,2019-07-03,"I have a beta version of a chrome extension app for the Poshmark platform and I need a chrome developer to help me fix the bugs in the app. Sharing speed is too fast. (Slow is fast and fast is extremely fast) - Bot won’t start unless page is reloaded - Newsfeed isn’t working - Newsfeed won’t load indefinitely - Follow new users : App only follows 53 new users - Clear console button doesn’t work when the ‘Follow” screen - the chrome web store payment does not work - The app goes back to its first page instead of the page that is active. Attached is an example of the bug in the app, that's not working. I need someone who understands english clearly and how to communicate these issues. less","Chrome Extension, Chrome OS, Firebase, JavaScript",NA,"$300+ ","5.00 Stars, based on 2 feedbacks","United States",NA,5,2
"950","Fullstack Developer needed to add automation out Kanbans","https://www.upwork.com/job/Fullstack-Developer-needed-add-automation-out-Kanbans_~01d53613fdc3a32f1a/","Intermediate",NA,2019-07-03,"FLOWFACT provides a Kanban based automation solution which allow their customer to run semi - and full automated processes. Further description how our automation works can be found under sources. To accomplish this project we need an new editor for our customer. The editor allows our customer to attach new Automations to each Kanban phases. A detailed description and the design we need can be found below. Furter informations are attached. Sources will be handover on project start. less","API, API Integration",NA,"$10k+ ","5.00 Stars, based on 12 feedbacks","Germany",NA,5,12
"951","Small video editing job","https://www.upwork.com/job/Small-video-editing-job_~01e5295e952bc62337/","Expert",10,2019-07-03,"I have 2 videos. 1st video is 39 seconds long (and 6.9MB). 2nd video is 32 minutes and 13 seconds long (and 372MB). Here's the edits I need made. 1. Need the 1st second of video 1 deleted 2. Need the last half-second of video 1 deleted 3. Need the last 38 seconds of video 2 deleted 4. Then need video 2 on 1.10X speed (10% faster) 5. Then need video 1 and video 2 combined into one video I need this all done without any of the audio quality or visual quality compromised. This should be a very simple task for an expert. I need it turned around immediately (shouldn't take you longer than 15 minutes) - I'm happy to wait up to an hour for rendering (I don't think it should even take that long). I'll send you the dropbox link to the video files when I hire you. Please only apply if you can start this task immediately and send me the finish video file within 90 minutes. If you do a great job, I'll likely have more tasks like this for you in the future. Thanks! less",NA,NA,"$4k+ ","4.86 Stars, based on 213 feedbacks","Australia",NA,4.86,213
"952","WORDPRESS WEBSITE SPEED OPTIMIZATION","https://www.upwork.com/job/WORDPRESS-WEBSITE-SPEED-OPTIMIZATION_~015ed66eaed60bdbc5/","Expert",50,2019-07-03,"Our website speed too slow, I hope it can be faster I'm looking for a highly skilled and sincere friend to help me solve my problem My website is www.mayajeans.com If you have a good ideas, Pls contace me. any time, thanks","WordPress",NA,"$0 ","No feedback yet","China",NA,NA,NA
"953","Professional Translation from English into Amharic","https://www.upwork.com/job/Professional-Translation-from-English-into-Amharic_~01393ff149067a583c/","Expert",NA,2019-07-03,"Hi all, We are looking for 1-2 translators to be part of a translation team for google account, from English into Amharic. Subject matters include: UI and Help, Marketing and some Legal. Requirements: - experience deadline with google account (or we can train you) - work with Trados - mandatory - live in US time zone (if possible) - native in Amharic We are looking for very professional translators. If interested, please send us an email and let us know your rate/experience as well. Looking forward to hearing back from you. Best regards, Lavinia less","Amharic",NA,"$40k+ ","5.00 Stars, based on 107 feedbacks","United States",NA,5,107
"954","Talented jewelry designer needed!","https://www.upwork.com/job/Talented-jewelry-designer-needed_~01cbbbc47d43059241/","Intermediate",100,2019-07-03,"Dear freelancers, I am looking for a jewelry designer (long term) for extravagant designs. My company offers high quality Sterling Silver and 18K Gold jewelry for women hence I am looking for a creative designer who is able to create extravagant and luxurious jewelry designs for us. The price is an estimated and will change depending on the project/ design and collection. Disclaimer: You have to sign an NDA plus all the designs you provide will be our property. Please provide past work of yours. Thank you! This job was posted from a mobile device, so please pardon any typos or any missing details. less","Jewelry, Jewelry Design, Jewelry Design Skills",NA,"$10k+ ","5.00 Stars, based on 15 feedbacks","Germany",NA,5,15
"955","Translate English to Japanese","https://www.upwork.com/job/Translate-English-Japanese_~013667b16a28a0b314/","Expert",65,2019-07-03,"I need this article translate in Japanese http://newsdaysguide.com/airphones/en/ I need the translation of the video subtitle and also the texts of the images And also the translation of this title in a maximum of 50 characters but maintaining the same meaning Tired of getting tangled in headphone wires? And this description Super-high quality earphones at an affordable price. Small and compact, these tiny powerhouses will change the way you listen to music forever. less","English, Japanese",NA,"$600+ ","4.97 Stars, based on 12 feedbacks","Brazil",NA,4.97,12
"956","Statistically determine effect on club performance of 'manager sacking' mid season","https://www.upwork.com/job/Statistically-determine-effect-club-performance-manager-sacking-mid-season_~01280b0916fc8f6e92/","Intermediate",NA,2019-07-03,"For a project of mine, I am looking for someone to help me with my statistical model: I need to determine if sacking the manager mid season (changing the manager) has an effect on the overall performance of the soccer team. I have already collected the data - which includes the historical performance for each match for the last 9 seasons of the English Premier League. The data also includes some other factors such as ranking of the team, ranking of the opponent, number of shots, number of cards, number of fouls, etc. Please include in your proposal what statistical model you plan on using for this analysis (time series, logistic regression, etc.) I plan on hiring someone for this job within the next couple of days. Thank you less","R",NA,"$800+ ","5.00 Stars, based on 3 feedbacks","Germany",NA,5,3
"957","Need Someone to Find 200 Belgian Websites","https://www.upwork.com/job/Need-Someone-Find-200-Belgian-Websites_~01590b7a2ab7eadf0f/","Entrylevel",NA,2019-07-03,"I need someone who can find 200 Belgian websites according to certain site metrics/criteria: - Domain Authority (Moz) - Trust Flow (Majestic) - IP address (I can provide a free online tool) - Topic It would be preferable if the candidate had access to Majestic and/or Moz and if they were from Belgium. If not, I can provide a free online tool for checking Domain Authority. I will also need the contact information of the site administrators (email addresses or contact forms). less","Data Analytics, Market Analysis",NA,"$0 ","No feedback yet","Denmark",NA,NA,NA
"958","Real estate virtual staging","https://www.upwork.com/job/Real-estate-virtual-staging_~01149161d60feaac1c/","Entrylevel",25,2019-07-03,"We are a real estate investment company looking for someone that can virtually stage our homes. This is one of many properties that we will be looking to have done over the next 12 months This job was posted from a mobile device, so please pardon any typos or any missing details. less","Digital Photography, Image Editing, Photo Editing, ",NA,"$1k+ ","5.00 Stars, based on 2 feedbacks","United States",NA,5,2
"959","2min Yoga Teacher Promo Video","https://www.upwork.com/job/2min-Yoga-Teacher-Promo-Video_~018d97a8261a0717bb/","Intermediate",150,2019-07-03,"I’m looking for an experienced editor to put together a 2min promo video of a Yoga teacher. This job was posted from a mobile device, so please pardon any typos or any missing details.","Adobe After Effects, Adobe Premiere Pro, Audio Editing,  ",NA,"$2k+ ","4.52 Stars, based on 4 feedbacks","United States",NA,4.52,4
"960","Shopify expert to populate theme ""Local"" with products, copy, and existing logo","https://www.upwork.com/job/Shopify-expert-populate-theme-quot-Local-quot-with-products-copy-and-existing-logo_~01aca231912011fc1c/","Intermediate",400,2019-07-03,"I am a graphic designer looking for someone very familiar with putting together Shopify sites. I have approx 12 products for now, all different flavours of juice. I would like our website populated with the products (1 image each, brief description of flavour, benefits, ingredients), some copy about the company and the product category in general, and maybe 3-4 other images. I require this project to begin on Thursday July 4 13:00 UTC and finished by Friday July 5 19:00 UTC. less","Shopify",NA,"$0 ","No feedback yet","",NA,NA,NA
"961","Virtual Receptionist for chiropractic clinic","https://www.upwork.com/job/Virtual-Receptionist-for-chiropractic-clinic_~01871d49624574c25c/","Entrylevel",NA,2019-07-03,"We require someone to answer our clinic phone from Monday - Friday from 9am-8pm. We require the same person to answer all calls (approx. 10-25 per day) and schedule patient appointments, give information about the clinic, control patient appointment ... more","Data Entry, Appointment Scheduling, Communication,  ",NA,"$0 ","No feedback yet","Australia",NA,NA,NA
"962","LinkedIn consultant","https://www.upwork.com/job/LinkedIn-consultant_~01912af2a860626e2b/","Expert",NA,2019-07-03,"Help setup and optimize our company's LinkedIn profile",NA,NA,"$9k+ ","4.36 Stars, based on 14 feedbacks","United States",NA,4.36,14
"963","Google shopping and data feed optimisation expert","https://www.upwork.com/job/Google-shopping-and-data-feed-optimisation-expert_~0114c085a2fad2ae46/","Entrylevel",NA,2019-07-03,"Looking for a very experienced google shopping data/feed expert Must have significant experience with google shopping campaigns with large product catalogues , data optimisation experience and ROI driven campaigns","Google Shopping, Retargeting",NA,"$1M+ ","4.51 Stars, based on 293 feedbacks","Malaysia",NA,4.51,293
"964","Looking for web developer with scraping experience for advice (~30min phone conversation)","https://www.upwork.com/job/Looking-for-web-developer-with-scraping-experience-for-advice-30min-phone-conversation_~013ba468c5eb35e314/","Intermediate",30,2019-07-03,"I’m an entrepreneur with no IT background looking for a web developer with scraping experience who can provide (high-level) advise on how to approach a given scraping problem. The scope of the assignment is a ~30min. phone conversation. The goal is to provide technical guidance and help me make a decision on how to move forward with a website project. In particular, I’m planning to launch a website that, among others, shows apartment listings collected from one or more other websites. For that purpose I need a solid system that automatically enters a pre-defined list of keywords in another website and extracts the resulting real estate data (text + images) several times a day. Further information can be provided during the call. Examples of questions we’re going to discuss: • Which principle options do I have to obtain a solution (e.g. data service provider, do-it-yourself software, hire developer for own code) and what are the pros/cons? • Which additional information is required to move forward with the project? • What is the expected cost (rough range) of building and running the scraping part of the project? • … less",NA,NA,"$0 ","No feedback yet","Switzerland",NA,NA,NA
"965","Google ad words optimization","https://www.upwork.com/job/Google-words-optimization_~019b1f2ae1dd16110b/","Expert",NA,2019-07-03,"Examine my current google ad words campaign. Examine my current google shopping campaign. See if any where needs improvement and optimization",NA,NA,"$1k+ ","5.00 Stars, based on 12 feedbacks","Canada",NA,5,12
"966","T-shirt Artist and Consultant","https://www.upwork.com/job/shirt-Artist-and-Consultant_~011cfc96fbfd408c6a/","Expert",NA,2019-07-03,"I need to create hat and shirt designs, mostly matching colors with my logo. I want someone I can refer to as my style guide / consultant to help over time. I have a couple T-shirt designs already, and basic cat designs, but I want to take it to the next level. I also want to coordinate with a sock factory in China to create some cool socks. I have the shirts, and the shirt colors all picked out, I just need to style them a bit with the logo, I’m also open to small variations. This job was posted from a mobile device, so please pardon any typos or any missing details. less","Graphic Design, Logo Design, Print Design",NA,"$300+ ","No feedback yet","United States",NA,NA,NA
"967","We need a UI for our new Integration-service","https://www.upwork.com/job/need-for-our-new-Integration-service_~01a50f8616df53afae/","Intermediate",NA,2019-07-03,"FLOWFACT provides a Kanban based automation solution which allow their customer to run semi - and full automated processes. Further description how our automation works can be found under Sources. Goal for this Project is to extent our Kanban view and Implement a UI for our integration service which allows our customer to create entities for an schema via Web Forms. The integration service already exist so only the frontend part needs to be done. The following pages describe the Layout and the user flow. Further Information you finde attached. Sources will be hand over on project start. less",NA,NA,"$10k+ ","5.00 Stars, based on 12 feedbacks","Germany",NA,5,12
"968","WP REST API","https://www.upwork.com/job/REST-API_~013c105b5cfd03b7b5/","Intermediate",NA,2019-07-03,"WP REST API extending Job description We have a social application in mobile platform and back-end is based on WP REST API. For user management, we are using custom PHP in WP We need to extend REST API for user profile uploading and save all user profile info including profile photo MySQL and 3rd party storage. If you are expert in WP REST API development, it will take a few hours only. less","API, Architecture Design, Automatic Test, ",NA,"$10k+ ","5.00 Stars, based on 13 feedbacks","Nigeria",NA,5,13
"969","Electrical Engineering","https://www.upwork.com/job/Electrical-Engineering_~019ef09a323262d5b4/","Intermediate",NA,2019-07-03,"Looking for Electrical Engineer that has both knowledge and experience in dealing with motion control chips. We want someone that could guide the team to a fuller and better understanding of motion control chips as well as speak to our potential clients. Not only that, you will also get to demostrate and present our products to our clients. If you are looking for a long term spot here with us, we do offer it too as long as you meet the above requirements <U+0001F60A> less",NA,NA,"$0 ","No feedback yet","Singapore",NA,NA,NA
"970","Full-Stack Developer wanted for integrations","https://www.upwork.com/job/Full-Stack-Developer-wanted-for-integrations_~017bbaeaaaeac02dc0/","Intermediate",NA,2019-07-03,"Looking for a full-stack developer for full-time work to support integrations and API development.","AngularJS, CSS, Node.js, API, API Integration, ",NA,"$10k+ ","5.00 Stars, based on 9 feedbacks","United States",NA,5,9
"971","Change WordPress Theme","https://www.upwork.com/job/Change-WordPress-Theme_~018d2eafac2cf1e7c3/","Intermediate",300,2019-07-03,"1. Change WordPress theme for existing website while retaining functionality and content. Details in attached project file. 2. Prior relevant experience with WordPress themes and shortcodes preferred. 3. Available for calls and remote sessions for clarifications if required. Timezone GMT +8. 4. Please indicate expected delivery timeline. less","WordPress",NA,"$0 ","No feedback yet","Singapore",NA,NA,NA
