"","jobtitle","joblink","jobLevel","budget","date","content","tags","numberOFfreelancers","totalspent","customerscore","country","customertype","score","Nfeedback"
"652","Need Lead Generation","https://www.upwork.com/job/Need-Lead-Generation_~01811f0ebceaf02607/","Intermediate",10,2019-07-03,"Hey! Looking for someone to build a list of leads matching the following criteria: Luxury Lifestyle Management Companies in Miami, Los Angeles & Las Vegas United States. Here is a website that list what these companies look like: https://luxe.digital/scene/best-luxury-concierge/ I Need: Name of Business City State Link to Website Name of Owner/Title(CEO) Owner Personal Email I will provide a shared Google Sheet document that your team can work on Must be willing to start immediately. Paying 10 cents per lead generated. This gig is for 100 leads, as a BONUS I will add a 5-star review on your profile :) less","Data Entry, Data Scraping, Market Research, Lead lists,  ",NA,"$300+ ","5.00 Stars, based on 2 feedbacks","United States",NA,5,2
"653","RSS feed aggregator (Python)","https://www.upwork.com/job/RSS-feed-aggregator-Python_~01dc7ff602d42c7752/","Intermediate",170,2019-07-03,"To develop an RSS feed aggregator that will support filtering and multiple RSS sources. It has to be written in Python. Please see the attached proposal. Please make sure this script will work on Windows Server 2016. Please see an attached code of the developer who started implementing the project. less","Internet Information Services (IIS, JSON,    ",NA,"$2k+ ","5.00 Stars, based on 13 feedbacks","United States",NA,5,13
"654","Dashboard Creation - Team Dashboard and Executive Dashboard","https://www.upwork.com/job/Dashboard-Creation-Team-Dashboard-and-Executive-Dashboard_~014b282d5fac2b3755/","Expert",NA,2019-07-03,"I require a Team Dashboard to be created and an Executive Dashboard too. The team dashboard will provide visualisation of key metrics for weekly performance and show trends over a length of time. We have 2 stores. The Executive dashboard will also provide the same information as the team dashboard but also provide information on other key areas of the business too. The executive dashboard will show the performance for each store less","PowerBI",NA,"$400+ ","4.46 Stars, based on 3 feedbacks","United Kingdom",NA,4.46,3
"655","Telecom Site Acquisition Process Diagram","https://www.upwork.com/job/Telecom-Site-Acquisition-Process-Diagram_~01b234c75e1e2eb097/","Entrylevel",NA,2019-07-03,"I am looking for an understanding of the process of cellular/telecom site acquisition, for tower-based and small cell sites. The ideal candidate will have significant experience as a site acquisition specialist, and will be able to describe the proc ... more",NA,3,"$0 ","No feedback yet","United States",NA,NA,NA
"656","Freelancer designer expertise required","https://www.upwork.com/job/Freelancer-designer-expertise-required_~014fd5cc243b8b022b/","Intermediate",NA,2019-07-03,"We're in the process of creating a job fair booth. What we require is 2 retractable banners and potentially a pamphlet highlighting our company / work perks etc. We have created a general document to be used as a guideline in regard to color-schemes / general direction however we're looking to work with a designer that can help us hone in on our message and tell our story. - This is for the design component, not the production. less",NA,NA,"$0 ","No feedback yet","Canada",NA,NA,NA
"657","AdWords Campaign","https://www.upwork.com/job/AdWords-Campaign_~01473078a52f23ebb5/","Expert",NA,2019-07-03,"Define and design Adwords campaign based on our target buyer Deploy, optimize and manage campaign Agree success metrics, measure and review","Google AdWords, Google Analytics, Google Tag Manager,  ",NA,"$5k+ ","4.29 Stars, based on 5 feedbacks","United States",NA,4.29,5
"658","VA for CST Part Time - $3 per hour - Must speak English - Data Entry/ Calls / Chats","https://www.upwork.com/job/for-CST-Part-Time-per-hour-Must-speak-English-Data-Entry-Calls-Chats_~014beecd985bb5b985/","Entrylevel",NA,2019-07-03,"Hi, PS: higher probability of getting hired if you leave an audio recording telling me a little bit about yourself and your experience. Not necessary but preferred. We are a STARTING (shopify) ecommerce store looking for a Part time VA to start of ... more","Customer Service, Data Entry, Product Listings, Administrative Support, ",2,"$2k+ ","4.95 Stars, based on 40 feedbacks","United States",NA,4.95,40
"659","Project Management","https://www.upwork.com/job/Project-Management_~011214b4e5ee59b591/","Intermediate",NA,2019-07-03,"Project management assistant taking care of day to day tasks, follow ups and research","Budgeting & Forecasting, Cost Control, Business case,   ",NA,"$0 ","No feedback yet","Kuwait",NA,NA,NA
"660","Looking for Social Media Marketer to Write, Schedule, Manage Facebook page posts & Ads","https://www.upwork.com/job/Looking-for-Social-Media-Marketer-Write-Schedule-Manage-Facebook-page-posts-amp-Ads_~01ce3ed923d55e6fd9/","Intermediate",70,2019-07-03,"Starting with 1 Facebook page . MUST BE HIGH QUALITY POSTS/ADVERT I am looking for an experienced Marketer/FB Advert Manager to write, schedule & Manage FB campaigns *****EXCELLENT written English skills require.****** SEE ATTACHMENT FOR FULL REQUIREMENT less","Facebook Marketing, Retargeting, Facebook Ad Campaign,  ",NA,"$20+ ","5.00 Stars, based on 1 feedback","United States",NA,5,1
"661","G suite to 365 migration.","https://www.upwork.com/job/suite-365-migration_~011cc43d70c0ac3014/","Expert",NA,2019-07-03,"I am looking to move 2 mail boxes from G suite to my new, 365 instance. Will involve setting up aliases migration of inbox contacts and calender. This job was posted from a mobile device, so please pardon any typos or any missing details.",NA,NA,"$1k+ ","4.79 Stars, based on 6 feedbacks","United Kingdom",NA,4.79,6
"662","White Hat SEO E-Commerce Expert Needed, Proven Track Record, References Required, Digital Ad Agency","https://www.upwork.com/job/White-Hat-SEO-Commerce-Expert-Needed-Proven-Track-Record-References-Required-Digital-Agency_~0166c2a00a9d1f5c91/","Intermediate",NA,2019-07-03,"I have 10 SEO clients that are on a monthly retainer with my web agency. 9 of them are on the Shopify E-commerce platform, and only 1 on WooCommerce. So if you have solid experience with Shopify that is a big plus. I need an SEO expert with a proven track record, 3 references of happy (preferably long-term clients), screenshots of rankings attained (and in what time-frame), and Enhanced E-commerce Analytics ROi screenshots (year over year). This would be an ongoing long-term contract position to manage all of our SEO client accounts every month. If you do not specialize in SEO, can't provide 3 client references, or demonstrate via Google Analytics Enhanced E-commerce that you can deliver a reasonable ROI per SEO spend then don't reply. You will not be considered for this position. less","Google AdWords, Google Analytics, Link Building, SEO Keyword Research,  ",NA,"$40k+ ","4.97 Stars, based on 53 feedbacks","United States",NA,4.97,53
"663","dimensions","https://www.upwork.com/job/dimensions_~019a9125985950ba2c/","Intermediate",50,2019-07-03,"I am building an underwater reef that is based on block letters. I have the images of the blocks but want area inside of each rectangle and colored lines on a certain measurements. letters attached all letters","3D Modeling, 3D Rendering",NA,"$20k+ ","4.97 Stars, based on 47 feedbacks","United States",NA,4.97,47
"664","Individual with EXPERT knowledge of Prezi App required ASAP","https://www.upwork.com/job/Individual-with-EXPERT-knowledge-Prezi-App-required-ASAP_~011cd07fb40689b100/","Expert",NA,2019-07-03,"We are looking for someone urgently with EXPERT level in Prezi APP to build 3 presentations in record timing! More information will be shared in direct response.","Prezi",NA,"$0 ","No feedback yet","Canada",NA,NA,NA
"665","Looking for a Native Dutch writer to transcribe a few interviews from NL -> NL","https://www.upwork.com/job/Looking-for-Native-Dutch-writer-transcribe-few-interviews-from_~01d8e4c0c90fb50af3/","Entrylevel",75,2019-07-03,"Plus minus 2 hours and thirty minutes not exceeding 3 hours of flemish audio files needed to be transcripted into dutch. So I need a native Dutch speaker!","Dutch, Captions, Documentation, Transcription, Written",NA,"$0 ","No feedback yet","Belgium",NA,NA,NA
"666","Fashion photographer needed for men/women and kids underwear","https://www.upwork.com/job/Fashion-photographer-needed-for-men-women-and-kids-underwear_~013ccbcef139092a22/","Intermediate",300,2019-07-03,"I need a photographer to arrange models (men/women/boys/girls) for clothes products. (Underwear and outdoor fashion) I need to see sample pictures before starting. The items will be sent to the photographer address in case of approval. Please send your previous relevant projects. less","Product, Fashion",3,"$10k+ ","4.24 Stars, based on 34 feedbacks","Kuwait",NA,4.24,34
"667","EDITOR NEEDED FOR 47,000 WORD MEMOIR","https://www.upwork.com/job/EDITOR-NEEDED-FOR-000-WORD-MEMOIR_~01d364c17cde25983c/","Entrylevel",250,2019-07-03,"I need an editor to read over my novel manuscript and give any sort of constructive feedback about the flow of the story, fix any grammar or misspelled words that I have missed, and assure that my manuscript is in proper format in regards to the preferences of publishers. This is the first book I have ever written! It's all about my self growth as a person through my journey of overcoming disordered eating, how veganism has enlightened me and changed my life, living as a gay person in a predominantly heterosexual world, my journey with minimalism, finding myself in college, working for the largest animal rights organization in the world at the age of 22, and traveling the country with my best friend while sleeping in her car and running into life changing adventures and experiences. I would like someone to edit this book who is open minded, forward thinking, and someone who has experience editing novels and formatting manuscripts. Thank you so much, peace and blessings. less",NA,NA,"$0 ","No feedback yet","United States",NA,NA,NA
"668","Logo Design","https://www.upwork.com/job/Logo-Design_~01a91ba7af2bff789a/","Entrylevel",NA,2019-07-03,"A logo for my new it company named GenIt. Color should be gree focused","Adobe Photoshop, Adobe Illustrator",NA,"$0 ","No feedback yet","Bangladesh",NA,NA,NA
"669","Freelancer needed for business voicemail recording","https://www.upwork.com/job/Freelancer-needed-for-business-voicemail-recording_~017f502b3c6d7673a0/","Intermediate",35,2019-07-03,"Freelancer with 1+ years experience needed for voicemail message of our company phone messaging system. This is a one-time job. You are required to provide 3 samples of past work so we get a sense of your work.","British English, American English, Young Adult, Female,  ",NA,"$20k+ ","3.80 Stars, based on 3 feedbacks","Canada",NA,3.8,3
"670","2 caricature/ cartoon illustrations","https://www.upwork.com/job/caricature-cartoon-illustrations_~01099b2fe301efd1c7/","Intermediate",NA,2019-07-03,"https://docs.google.com/document/d/16LpEQUjxfTdLp2KL1FKrK5SfD2g9rCRiVpPz7xovvAg/edit?usp=sharing we need two illustrations with above-mentioned story line.","Caricature Drawing, Cartooning, Graphic Design,  ",NA,"$20k+ ","4.99 Stars, based on 28 feedbacks","United States",NA,4.99,28
"671","Graphic Design","https://www.upwork.com/job/Graphic-Design_~019e6b27b678666665/","Intermediate",NA,2019-07-03,"I am looking for someone to create Illustrator visuals from variable data that include lists of names, distances, numbers and country flag images. These are bibs for a marathon. The visuals of the marathon bibs for each category are already existing, ... more","Infographics, Adobe Illustrator, List, ",NA,"$0 ","No feedback yet","Canada",NA,NA,NA
"672","Logo Creation","https://www.upwork.com/job/Logo-Creation_~011ca1bc1b3f5f9ac2/","Intermediate",NA,2019-07-03,"I would like a modern catchy logo. Please send me examples of past to see","Infographics",NA,"$400+ ","5.00 Stars, based on 1 feedback","United States",NA,5,1
"673","Provide a list of 1 million Blockchain Traders and send 1 millions emails","https://www.upwork.com/job/Provide-list-million-Blockchain-Traders-and-send-millions-emails_~01229fb7f2fb377887/","Expert",1000,2019-07-03,"Hi all ! We are cocoricos.io and we would like to constitute a list of millions of emails from Blockchain Traders, people that are interested by Coinbase, Binance, Kucoin and other exchanges. We will also require you to manage the sending of these emails. Best Luck to everyone^^ less","Lead Generation, MailChimp, Marketo, Salesforce.com,  ",NA,"$10k+ ","4.98 Stars, based on 11 feedbacks","France",NA,4.98,11
"674","Take Photos of Real Esate in San Juan, Puerto Rico","https://www.upwork.com/job/Take-Photos-Real-Esate-San-Juan-Puerto-Rico_~01ea3691486c36c69f/","Entrylevel",NA,2019-07-03,"Take photos & video of real estate in San Juan, Puerto Rico. You will be provided a contact for real estate agent. You must schedule an appointment to take photos of the property and immediate neighborhood(streets, around the block) Upload the photos/video to dropbox or google drive for access. Minimum 100 photos Short video clips less",NA,NA,"$7k+ ","4.76 Stars, based on 56 feedbacks","United States",NA,4.76,56
"675","Opencart Developer / Site Scraper","https://www.upwork.com/job/Opencart-Developer-Site-Scraper_~01d30cb478097cda22/","Expert",500,2019-07-03,"We are currently running a total of 3 websites. Firstly, we want our websites to mesh together better so it is easier for us to run. All of our websites are currently separate and are totally different. We want to change the websites so they all look ... more",NA,NA,"$3k+ ","No feedback yet","Ireland",NA,NA,NA
"676","Data Gathering/Data Entry/Internet Research","https://www.upwork.com/job/Data-Gathering-Data-Entry-Internet-Research_~01f5798ce5309f5a98/","Entrylevel",NA,2019-07-03,"We have an immediate need for someone to help us with: -searching web pages -inputing data into a spreadsheet","Administrative Support, Data Entry, Data Scraping,  ",5,"$1M+ ","4.95 Stars, based on 152 feedbacks","United States",NA,4.95,152
"677","junit test writer","https://www.upwork.com/job/junit-test-writer_~012240a2753e980ca8/","Intermediate",10,2019-07-03,"Hello, We have a small class with 40 methods You will have to write junit test","Java",NA,"$30k+ ","4.97 Stars, based on 195 feedbacks","France",NA,4.97,195
"678","Financial Planner - Real Estate Experience preferred","https://www.upwork.com/job/Financial-Planner-Real-Estate-Experience-preferred_~018003a898170e49bf/","Intermediate",NA,2019-07-03,"Looking for meaningful work that can help build your resume? I'm looking for a Financial Planner who is an accomplished communicator and has some Real Estate experience in residential rental properties.","Business Planning",NA,"$10k+ ","4.97 Stars, based on 19 feedbacks","Canada",NA,4.97,19
"679","Customer Service Consultant","https://www.upwork.com/job/Customer-Service-Consultant_~011b41db59bec8aa33/","Expert",NA,2019-07-03,"Fusion Funnel is looking for an experienced customer service/support consultant to develop strategies and a framework for support. We are a product team looking to have an increase in customers in the next couple of weeks and we want to make sure we are ready to provide great customer service. We use Zendesk for our knowledge base and we are in the process of setting this up for support. We are looking for individuals that have experience with creating strategies and can guide us on the solutions that we will need. List of deliverables: - Understand our product to provide adequate feedback - Develop a strategy to handle support requests using Zendesk - Provide set up guidelines for Zendesk - Create a list of resources that will be needed based on our user count - Provide insights for support best practices - Aid in organizing our knowledgebase - Answer questions the team will have less","Zendesk, Ticketing systems",NA,"$70k+ ","5.00 Stars, based on 23 feedbacks","United States",NA,5,23
"680","Need Someone To Translate / Fix French Page","https://www.upwork.com/job/Need-Someone-Translate-Fix-French-Page_~019dfda23e33baaf48/","Entrylevel",20,2019-07-03,"I need someone to translate 1 webpage. It has already been translated to french using google translator, but needs to be fixed to sound more natural / correct. Translations will be checked and verified. If possible we are looking for a 24 hour turnaround. less","English, French, Proofreading, Translation",NA,"$20k+ ","4.97 Stars, based on 57 feedbacks","United States",NA,4.97,57
"681","Web Design, Art Direction, Landing Pages, SM Ads","https://www.upwork.com/job/Web-Design-Art-Direction-Landing-Pages-Ads_~01e6f372c1d4d805b0/","Intermediate",NA,2019-07-03,"Seeking art director or interactive designer to assist w/ various projects related to hospitality startup. Note: We can only hire from Americas time zones. Project Types: - SM Ads - Landing Pages - Email marketing designs - Image sourcing, editing ... more","Digital Design, Interactive Design, Visual Design, ",NA,"$90k+ ","5.00 Stars, based on 15 feedbacks","United States",NA,5,15
"682","Call Handler/Virtual Receptionist","https://www.upwork.com/job/Call-Handler-Virtual-Receptionist_~010155e70f7f727669/","Entrylevel",NA,2019-07-03,"We're looking for someone to handle phone calls. We want someone with a strong, clear voice, fluent English language skills, excellent communication skills, friendly personality, large computer memory, strong Wi Fi, good mic and headphones, and no background noise. Preferably someone with architectural background to help with client files, plan reviews, customer inquiries, etc. less","Call Handling, Communication etiquette,   ",NA,"$1M+ ","4.93 Stars, based on 148 feedbacks","United States",NA,4.93,148
"683","Looking for an enthusiastic sales person to make cold-calls for Insurance/benefits company","https://www.upwork.com/job/Looking-for-enthusiastic-sales-person-make-cold-calls-for-Insurance-benefits-company_~017b989fe6fca22b11/","Intermediate",NA,2019-07-03,"I will provide phone numbers and auto-dial system. You will need to have a basic understanding of Insurance/benefits business. Your main task will be to schedule appointments. You need to be accent-free and well versed.","Appointment Setting, Appointments, Lead list",NA,"$3k+ ","5.00 Stars, based on 3 feedbacks","Canada",NA,5,3
"684","Customer Service A+ Players Wanted!","https://www.upwork.com/job/Customer-Service-Players-Wanted_~01a7542bd882f8ec3d/","Intermediate",NA,2019-07-03,"This is a full-time position so please read carefully before applying for the position. We're a growing eCommerce company & expanding our Customer Service Team. We operate multiple eCommerce brands using Amazon and eBay. Our customer service team is currently consist of a very limited group of people and we are hiring 5 more. We're growing a lot! In this role, you'll work Monday - Sunday 5-6 hours per day answering customer messages through seller central and eBay platform, looking up for any new orders on eBay, check for any system notifications that may be affecting our product listings on both channels and coordinate with the appropriate agent on the team to help resolve the issue. Do let us know what is your least favorite type of sports on top of your cover letter. You must be highly skilled in using Amazon and eBay and must have great knowledge about how it all works from the customer orders to processing customer’s claims. We're looking to build a long term relationship with passionate leaders who are driven to make customers happy. If you're proactive and great at your job, you'll find many opportunities for learning and expanded responsibilities. Required skills: Excellent written & spoken English Experience with Amazon Seller Central Experience with Shopify & eBay Demonstrated results of being a great customer service agent Interested in a long term job Days: Monday - Sunday Time: 9 AM - 3 PM EST (https://www.timeanddate.com/worldclock/usa/new-york) However, please note that you may work a different schedule for 1 - 2 weeks during training. Notes: You will be expected to work most USA holidays. If you can't work Saturdays and Sundays, please do not apply. We are flexible about taking days off when you need to. Simply communicate with us about it and there shouldn't be a problem. What will be provided (input): Daily & Weekly Goals Access to all platforms and a shared group chat with other team members for collaboration All necessary training and resources to hit your goals i.e. canned responses, macros, SOPs, etc. How to submit your application: For your application to be considered please include in your proposal numbered answers to: What is your past phone agent experience? - How soon can you start working? - Please confirm you understand we only use Upwork to pay our agents. - Your hourly rate so we know how much it will cost us to keep working with you. - In the past when you worked with other clients, what was the most difficult situation that you came across and how did you solve it? - Submit a 2 mins video recording of yourself explaining why you’re a good fit and what are the top 3 rules to great customer experience - What Amazon Marketplaces have you worked with previously (i.e. .com, .ca, .mx, .com.uk, etc...) less","Time Management, Answering Product Questions,  ",3,"$0 ","No feedback yet","Pakistan",NA,NA,NA
"685","Chef Meal Preparation App Android","https://www.upwork.com/job/Chef-Meal-Preparation-App-Android_~011b4ef6c0ef564911/","Intermediate",3000,2019-07-03,"I need a Chef Meal Preparation App made for Android using AWS Backend;",NA,NA,"$20k+ ","4.86 Stars, based on 21 feedbacks","United States",NA,4.86,21
